Número de identificação da publicação;Link permanente;Publicar mensagem;Tipo;Países;Idiomas;Publicado;Direcionamento do público;Lifetime Post Total Reach;Lifetime Post organic reach;Lifetime Post Paid Reach;Lifetime Post Total Impressions;Lifetime Post Organic Impressions;Lifetime Post Paid Impressions;Lifetime Engaged Users;Lifetime Matched Audience Targeting Consumers on Post;Lifetime Matched Audience Targeting Consumptions on Post;Lifetime Negative Feedback from Users;Lifetime Negative Feedback;Lifetime Post Impressions by people who have liked your Page;Lifetime Post reach by people who like your Page;Lifetime Post Paid Impressions by people who have liked your Page;Lifetime Paid reach of a post by people who like your Page;Lifetime People who have liked your Page and engaged with your post;Lifetime Organic views to 95%...25;Lifetime Organic views to 95%...26;Lifetime Paid views to 95%...27;Lifetime Paid views to 95%...28;Lifetime Organic Video Views...29;Lifetime Organic Video Views...30;Lifetime Paid Video Views...31;Lifetime Paid Video Views...32;Lifetime Average time video viewed;Lifetime Video length;Descrição;share;like;comment
417092451820846_444648149065276;https://www.facebook.com/lojascitycol/photos/a.418868384976586/444648149065276/?type=3;A nossa nova coleção será lançada nesta quinta-feira (25/2), na Citycol Duque de Caxias! Nós e a Maria Joana estaremos esperando você na Av. Nilo Peçanha, 276, Centro das 14h às 16h. Venha conferir as novidades! #nacitycoltem;Photo;NA;NA;2016-02-22T11:17:07Z;NA;0;0;0;0;0;0;0;0;0;0;0;0;0;0;0;0;0;0;0;0;0;0;0;0;0;0;Lifetime: The number of stories created about your Page post, by action type. (Total Count);53;1313;52
417092451820846_443434679186623;https://www.facebook.com/lojascitycol/photos/a.418868384976586/443434679186623/?type=3;A nova coleção da Citycol está incrível junto com a Maria Joana, já conferiu? Dá uma olhada nas novidades que a gente trouxe e veja o look que mais combina com você: bit.ly/1Qog4Cq #nacitycoltem;Photo;NA;NA;2016-02-18T08:54:09Z;NA;0;0;0;0;0;0;0;0;0;0;0;0;0;0;0;0;0;0;0;0;0;0;0;0;0;0;NA;33;2503;65
417092451820846_443400289190062;https://www.facebook.com/lojascitycol/photos/a.443399889190102/443400289190062/?type=3;Blusa com fenda  Tam: P M G  R$ 19,99 Cód.: 876713;Photo;NA;NA;2016-02-18T07:56:00Z;NA;0;0;0;0;0;0;0;0;0;0;0;0;0;0;0;0;0;0;0;0;0;0;0;0;0;0;NA;NA;50;3
417092451820846_441676472695777;https://www.facebook.com/lojascitycol/photos/a.418868384976586/441676472695777/?type=3;A próxima coleção está maravilhosa e quase chegando nas lojas! A Citycol tem o look certo para deixar você linda na estação mais charmosa do ano. Fique ligada nas novidades! #nacitycoltem 😉;Photo;NA;NA;2016-02-12T12:54:57Z;NA;0;0;0;0;0;0;0;0;0;0;0;0;0;0;0;0;0;0;0;0;0;0;0;0;0;0;NA;10;2057;25
417092451820846_439601976236560;https://www.facebook.com/lojascitycol/videos/439601976236560/;Quer saber como foi o lançamento da Coleção de Carnaval Citycol com a Maria Joana? Confira aqui o que rolou na nossa loja em Madureira e aproveite para montar o seu look incrível. Ainda dá tempo de brilhar durante a folia! #citycol;Video;NA;NA;2016-02-05T04:39:32Z;NA;12370;11910;0;17939;17077;0;1485;1386;1553;0;0;7730;4541;0;0;738;2055;2150;0;0;4075;4531;0;0;0;15440;NA;8;156;3
417092451820846_439136822949742;https://www.facebook.com/lojascitycol/photos/a.418868384976586/439136822949742/?type=3;Quer saber como foi o lançamento da Coleção de Carnaval Citycol com a Maria Joana? Confira aqui o que rolou na nossa loja em Madureira e aproveite para montar o seu look incrível. Ainda dá tempo de brilhar durante a folia! #citycol http://on.fb.me/1KqkVGR;Photo;NA;NA;2016-02-03T09:57:13Z;NA;0;0;0;0;0;0;0;0;0;0;0;0;0;0;0;0;0;0;0;0;0;0;0;0;0;0;NA;11;5562;27
417092451820846_439134856283272;https://www.facebook.com/lojascitycol/photos/a.439134836283274/439134856283272/?type=3;Lançamento Coleção Carnaval Citycol - Loja Madureira;Photo;NA;NA;2016-02-03T09:52:54Z;NA;0;0;0;0;0;0;0;0;0;0;0;0;0;0;0;0;0;0;0;0;0;0;0;0;0;0;NA;NA;26;1
417092451820846_438463616350396;https://www.facebook.com/lojascitycol/photos/a.418868384976586/438463616350396/?type=3;Agora você pode! A musa Maria Joana irá lançar a nossa coleção de carnaval na Citycol de Madureira. Ela estará esperando você nesta terça dia 02/02 na Estrada do Portela, 23 - Madureira, das 14h às 16h para tirar uma foto. Corre lá!;Photo;NA;NA;2016-02-01T06:11:00Z;NA;0;0;0;0;0;0;0;0;0;0;0;0;0;0;0;0;0;0;0;0;0;0;0;0;0;0;NA;14;460;15
417092451820846_436403793223045;https://www.facebook.com/lojascitycol/photos/a.418868384976586/436403793223045/?type=3;Pronta para o Carnaval? A musa Maria Joana  mostra como arrasar na avenida com a Coleção Carnaval Citycol. Confere aí! http://on.fb.me/1SfDJcZ;Photo;NA;NA;2016-01-25T13:07:12Z;NA;0;0;0;0;0;0;0;0;0;0;0;0;0;0;0;0;0;0;0;0;0;0;0;0;0;0;NA;25;1957;58
417092451820846_436403349889756;https://www.facebook.com/lojascitycol/photos/a.436403189889772/436403349889756/?type=3;Regata + Cropped R$22,99 Cod. 876552 Short R$15,99 Cod. 974858;Photo;NA;NA;2016-01-25T13:03:03Z;NA;0;0;0;0;0;0;0;0;0;0;0;0;0;0;0;0;0;0;0;0;0;0;0;0;0;0;NA;1;37;NA
417092451820846_436319709898120;https://www.facebook.com/lojascitycol/videos/436319709898120/;"Que tal um gostinho do que vem por aí na coleção outono 2016 da #Citycol? A nossa musa Maria Joana te mostra ;)";Video;NA;NA;2016-01-25T06:20:08Z;NA;16465;16261;0;22195;21811;0;901;828;932;1;1;7625;4635;0;0;417;1582;1684;0;0;3407;3691;0;0;0;11677;NA;4;111;5
417092451820846_434712710058820;https://www.facebook.com/lojascitycol/photos/a.418868384976586/434712710058820/?type=3;Já está preparada para a folia? A Citycol preparou uma coleção especialmente para você curtir o Carnaval. Fique ligada nas novidades! Vem coisa boa por aí ...;Photo;NA;NA;2016-01-19T13:08:53Z;NA;0;0;0;0;0;0;0;0;0;0;0;0;0;0;0;0;0;0;0;0;0;0;0;0;0;0;NA;18;1753;18
417092451820846_429479097248848;https://www.facebook.com/lojascitycol/photos/a.418868384976586/429479097248848/?type=3;A musa Maria Joana traz as tendências de verão da Citycol! Essas novidades você não vai perder, não é? Confira aqui o que preparamos: http://on.fb.me/1OGPN1a;Photo;NA;NA;2016-01-04T09:08:04Z;NA;0;0;0;0;0;0;0;0;0;0;0;0;0;0;0;0;0;0;0;0;0;0;0;0;0;0;NA;40;3313;40
417092451820846_429478737248884;https://www.facebook.com/lojascitycol/photos/a.429478107248947/429478167248941/?type=3;Verão Citycol #1;Photo;NA;NA;2016-01-04T09:05:16Z;NA;0;0;0;0;0;0;0;0;0;0;0;0;0;0;0;0;0;0;0;0;0;0;0;0;0;0;NA;NA;NA;NA
417092451820846_426209047575853;https://www.facebook.com/lojascitycol/photos/a.418868384976586/426209047575853/?type=3;Você consegue adivinhar o que vem por aí? Em breve nossa coleção de verão! ☀👗;Photo;NA;NA;2015-12-23T12:29:46Z;NA;0;0;0;0;0;0;0;0;0;0;0;0;0;0;0;0;0;0;0;0;0;0;0;0;0;0;NA;7;1823;9
417092451820846_422538617942896;https://www.facebook.com/lojascitycol/photos/a.418868384976586/422538617942896/?type=3;"Chegamos com mais peças incríveis pra vocês! Estampas e cores do verão continuam dominando os looks ;) E aí, gostaram? Confira aqui: http://on.fb.me/1jSR8Kj #SóNaCitycol";Photo;NA;NA;2015-12-11T05:13:04Z;NA;0;0;0;0;0;0;0;0;0;0;0;0;0;0;0;0;0;0;0;0;0;0;0;0;0;0;NA;17;1127;44
417092451820846_422537791276312;https://www.facebook.com/lojascitycol/photos/a.422537397943018/422537671276324/?type=3;Vestido (código 875309);Photo;NA;NA;2015-12-11T05:08:58Z;NA;0;0;0;0;0;0;0;0;0;0;0;0;0;0;0;0;0;0;0;0;0;0;0;0;0;0;NA;NA;NA;NA
417092451820846_421594378037320;https://www.facebook.com/lojascitycol/photos/a.418868384976586/421594378037320/?type=3;Estão ansiosas pelos próximos lançamentos? Fiquem ligadas por aqui, porque daqui a pouco teremos mais novidades imperdíveis! #SóNaCitycol;Photo;NA;NA;2015-12-07T12:30:00Z;NA;0;0;0;0;0;0;0;0;0;0;0;0;0;0;0;0;0;0;0;0;0;0;0;0;0;0;NA;NA;56;NA
417092451820846_420792024784222;https://www.facebook.com/lojascitycol/photos/a.418868384976586/420792024784222/?type=3;Nossa oferta de lingerie abrange todas as idades, tamanhos e cores. Com a chegada do verão a moda íntima também tende a ficar mais colorida e alegre.;Photo;NA;NA;2015-12-04T02:22:19Z;NA;0;0;0;0;0;0;0;0;0;0;0;0;0;0;0;0;0;0;0;0;0;0;0;0;0;0;NA;6;311;26
417092451820846_420199728176785;https://www.facebook.com/lojascitycol/photos/a.418868384976586/420199728176785/?type=3;Neste final de ano a tendência mais forte é nas estampas: floridas, de folhagens, étnicas e listradas. As cores são vivas destacando os diversos tons de amarelo, azul, verde, rosa e vermelho além dos clássicos preto e crú. Confira nossas peças aqui: http://on.fb.me/1MUClt2 #SóNaCitycol;Photo;NA;NA;2015-12-01T12:28:21Z;NA;0;0;0;0;0;0;0;0;0;0;0;0;0;0;0;0;0;0;0;0;0;0;0;0;0;0;NA;19;3782;39
417092451820846_420166381513453;https://www.facebook.com/lojascitycol/photos/a.420161821513909/420161831513908/?type=3;Regata (código 875351) Saia (código 870062);Photo;NA;NA;2015-12-01T09:06:10Z;NA;0;0;0;0;0;0;0;0;0;0;0;0;0;0;0;0;0;0;0;0;0;0;0;0;0;0;NA;NA;NA;NA
417092451820846_418844471645644;https://www.facebook.com/lojascitycol/photos/a.418868384976586/418844471645644/?type=3;"Já chegamos com tudo por aqui! Se você ama moda e preços maravilhosos, mal pode esperar pelo nosso lançamento de Natal ;) Fique ligada na nossa página pra saber das novidades que vão bombar nesse final de ano! 💃👠🎁#NaCitycolTem";Photo;NA;NA;2015-11-25T13:00:01Z;NA;0;0;0;0;0;0;0;0;0;0;0;0;0;0;0;0;0;0;0;0;0;0;0;0;0;0;NA;4;97;1
417092451820846_418776171652474;https://www.facebook.com/lojascitycol/posts/418776191652472:0;Lojas Citycol;Photo;NA;NA;2015-11-25T04:23:03Z;NA;0;0;0;0;0;0;0;0;0;0;0;0;0;0;0;0;0;0;0;0;0;0;0;0;0;0;NA;15;85;2
417092451820846_484948175035273;https://www.facebook.com/lojascitycol/photos/a.418868384976586/484948175035273/?type=3;Porque estilo é a gente que cria! A nossa coleção plus size chegará com tudo nas lojas a partir dessa quinta (16/6), vem conferir e faça a sua própria moda: http://bit.ly/1PsAhrA  #NaCitycolTem;Photo;NA;NA;2016-06-14T15:09:13Z;NA;0;0;0;0;0;0;0;0;0;0;0;0;0;0;0;0;0;0;0;0;0;0;0;0;0;0;Lifetime: The number of stories created about your Page post, by action type. (Total Count);67;5903;176
417092451820846_484928531703904;https://www.facebook.com/lojascitycol/photos/a.484928518370572/484928531703904/?type=3;Blusa R$14,99;Photo;NA;NA;2016-06-14T13:22:09Z;NA;0;0;0;0;0;0;0;0;0;0;0;0;0;0;0;0;0;0;0;0;0;0;0;0;0;0;NA;1;25;1
417092451820846_480834162113341;https://www.facebook.com/lojascitycol/photos/a.418868384976586/480834162113341/?type=3;O amor é um sentimento que nunca sai de moda! Comemore esse #diadosnamorados com muita paixão e estilo, vem dar uma olhada na nova coleção que a gente preparou para essa data especial: http://bit.ly/22xEUbh <3 Em todas as lojas a partir de 02/06  #NaCitycolTem;Photo;NA;NA;2016-06-01T06:49:21Z;NA;0;0;0;0;0;0;0;0;0;0;0;0;0;0;0;0;0;0;0;0;0;0;0;0;0;0;NA;89;19670;120
417092451820846_480828188780605;https://www.facebook.com/lojascitycol/photos/a.480828172113940/480828188780605/?type=3;Vestido  R$ 29,99 Cód.: 876903  Tam: M/ G/ GG;Photo;NA;NA;2016-06-01T06:43:52Z;NA;0;0;0;0;0;0;0;0;0;0;0;0;0;0;0;0;0;0;0;0;0;0;0;0;0;0;NA;2;58;8
417092451820846_477781165751974;https://www.facebook.com/lojascitycol/photos/a.418868384976586/477781165751974/?type=3;A coleção mais apaixonante do ano chegará com tudo na próxima quinta-feira (2/6)! Prepare-se para o #diadosnamorados com estilo, personalidade e amor. #NaCitytcolTem;Photo;NA;NA;2016-05-24T08:00:00Z;NA;0;0;0;0;0;0;0;0;0;0;0;0;0;0;0;0;0;0;0;0;0;0;0;0;0;0;NA;37;7701;45
417092451820846_475899835940107;https://www.facebook.com/lojascitycol/photos/a.475899272606830/475899835940107/?type=3;Seu Estilo Citycol;Photo;NA;NA;2016-05-18T12:52:15Z;NA;0;0;0;0;0;0;0;0;0;0;0;0;0;0;0;0;0;0;0;0;0;0;0;0;0;0;NA;1;67;7
417092451820846_471782096351881;https://www.facebook.com/lojascitycol/photos/a.418868384976586/471782096351881/?type=3;"Nós amamos tanto a beleza, que ser mãe é uma das coisas mais bonitas que já vimos! Com qual look Citycol você deixaria ela ainda mais linda? Compartilha com a gente e não esqueça de marcar a sua mãe. <3  Uma dica: você pode encontrar o visual perfeito para ela bem aqui: http://bit.ly/1Teg0He ;) #NaCitycolTem";Photo;NA;NA;2016-05-05T12:29:12Z;NA;0;0;0;0;0;0;0;0;0;0;0;0;0;0;0;0;0;0;0;0;0;0;0;0;0;0;NA;132;7153;27
417092451820846_468774353319322;https://www.facebook.com/lojascitycol/photos/a.418868384976586/468774353319322/?type=3;Para você que estava ansiosa pela coleção de Dia das Mães, olha ela aí! :D Gostou? Então corre, porque a partir desta quinta 28/04 essas peças lindas estarão em todas as nossas lojas e você já pode garantir o presente da sua mãe. Confere aqui: http://bit.ly/1Teg0He <3  #DiaDasMãesCitycol;Photo;NA;NA;2016-04-27T10:41:22Z;NA;0;0;0;0;0;0;0;0;0;0;0;0;0;0;0;0;0;0;0;0;0;0;0;0;0;0;NA;141;10424;248
417092451820846_468770606653030;https://www.facebook.com/lojascitycol/photos/a.468770589986365/468770606653030/?type=3;Vestido Listrado R$ 29,99 Cód.: 877011 Tam.: M / G / GG;Photo;NA;NA;2016-04-27T10:37:43Z;NA;0;0;0;0;0;0;0;0;0;0;0;0;0;0;0;0;0;0;0;0;0;0;0;0;0;0;NA;6;79;13
417092451820846_466969500166474;https://www.facebook.com/lojascitycol/photos/a.418868384976586/466969500166474/?type=3;Quer deixar a sua mãe mais bonita e na moda do que ela já é? Então fica de olho na nossa próxima coleção feita especialmente para ela! <3 #NaCitycolTem #EmBreve #DiaDasMaes;Photo;NA;NA;2016-04-22T12:41:50Z;NA;0;0;0;0;0;0;0;0;0;0;0;0;0;0;0;0;0;0;0;0;0;0;0;0;0;0;NA;31;3815;26
417092451820846_463933087136782;https://www.facebook.com/lojascitycol/photos/a.418868384976586/463933087136782/?type=3;A febre do jeans nunca sai de moda! Dê uma olhada nos looks incríveis que temos para você ousar com vários estilos diferentes. Coleção disponível em todas as lojas a partir de quinta-feira 14/04.  Clica no link: http://bit.ly/1T4kEdl  #NaCitycolTem;Photo;NA;NA;2016-04-13T10:07:06Z;NA;0;0;0;0;0;0;0;0;0;0;0;0;0;0;0;0;0;0;0;0;0;0;0;0;0;0;NA;103;10556;206
417092451820846_463928633803894;https://www.facebook.com/lojascitycol/photos/a.463928610470563/463928633803894/?type=3;Colete Franjas R$ 24,99 Tam.: P / M / G Cód: 876795  Calça Jeans R$ 59,99 Tam.: 40 / 42 / 44 / 46 Cód: 977148  Baby Look R$ 15,99 Tam.: P / M / G / GG Cód: 977132;Photo;NA;NA;2016-04-13T09:59:21Z;NA;0;0;0;0;0;0;0;0;0;0;0;0;0;0;0;0;0;0;0;0;0;0;0;0;0;0;NA;NA;39;23
417092451820846_463318027198288;https://www.facebook.com/lojascitycol/posts/463318027198288;A Mell Nasgon fala sobre a moda high low e conta vários looks que encontrou na Citycol. E, o melhor, o tema é plus size! Dá uma olhada no vídeo e se inspire para as suas próximas comprinhas =).  Quem quiser seguir ela no Instagram, anota aí @mellzitanasgon.;Link;NA;NA;2016-04-11T11:29:07Z;NA;0;0;0;0;0;0;0;0;0;0;0;0;0;0;0;0;0;0;0;0;0;0;0;0;0;0;NA;6;63;4
417092451820846_461600574036700;https://www.facebook.com/lojascitycol/photos/a.418868384976586/461600574036700/?type=3;Que o inverno venha com muito estilo! Um bom jeito de arrasar na estação é montando os seus looks Citycol favoritos. Dá um olhada no que temos de novidades em todas as lojas nesta 5a feira: http://bit.ly/1quxyb9  #NaCitycolTem;Photo;NA;NA;2016-04-06T10:56:54Z;NA;0;0;0;0;0;0;0;0;0;0;0;0;0;0;0;0;0;0;0;0;0;0;0;0;0;0;NA;80;9802;101
417092451820846_461593024037455;https://www.facebook.com/lojascitycol/photos/a.461593014037456/461593024037455/?type=3;Baby Look R$ 15,99 Tamanhos P M G GG Cod.: 871822  Calça Jeans R$49,99 Tamanhos 40 42 44 46 Cod.: 977002;Photo;NA;NA;2016-04-06T10:48:19Z;NA;0;0;0;0;0;0;0;0;0;0;0;0;0;0;0;0;0;0;0;0;0;0;0;0;0;0;NA;1;25;NA
417092451820846_457963911067033;https://www.facebook.com/lojascitycol/photos/a.418868384976586/457963911067033/?type=3;Preparada para o inverno? Então aguarde a nossa coleção que está chegando com tudo especialmente para essa estação. Fique ligada!  #NaCitycolTem;Photo;NA;NA;2016-03-29T15:48:56Z;NA;0;0;0;0;0;0;0;0;0;0;0;0;0;0;0;0;0;0;0;0;0;0;0;0;0;0;NA;10;1717;13
417092451820846_454229938107097;https://www.facebook.com/lojascitycol/photos/a.418868384976586/454229938107097/?type=3;Quer novidade na moda toda semana? Cola com a gente e confira toda quinta-feira nas lojas o que temos de novo para você ousar! #NaCitycolTem⁠⁠⁠⁠;Photo;NA;NA;2016-03-22T13:22:51Z;NA;0;0;0;0;0;0;0;0;0;0;0;0;0;0;0;0;0;0;0;0;0;0;0;0;0;0;NA;37;2396;32
417092451820846_451926005004157;https://www.facebook.com/lojascitycol/photos/a.418868384976586/451926005004157/?type=3;Tem mais novidade na Citycol! A coleção Meia Estação já está em todas as lojas, que tal conferir? Corra e garanta seu look 😉 Confira no link: https://goo.gl/wWU8P0   #nacitycoltem;Photo;NA;NA;2016-03-16T09:23:36Z;NA;0;0;0;0;0;0;0;0;0;0;0;0;0;0;0;0;0;0;0;0;0;0;0;0;0;0;NA;67;5036;124
417092451820846_451924655004292;https://www.facebook.com/lojascitycol/photos/a.451924638337627/451924655004292/?type=3;Kaftan R$22,99 Tamanhos P M G Cód.: 876796  Legging R$19,99 Tamanhos  P M G GG Cód.: 819641;Photo;NA;NA;2016-03-16T09:18:33Z;NA;0;0;0;0;0;0;0;0;0;0;0;0;0;0;0;0;0;0;0;0;0;0;0;0;0;0;NA;NA;50;1
417092451820846_447553745441383;https://www.facebook.com/lojascitycol/photos/a.418868384976586/447553745441383/?type=3;Nova estação, novos looks! A coleção de Outono já está disponível em todas as lojas Citycol, dá uma conferida nas novidades maravilhosas que preparamos para você: on.fb.me/21a0FvB  #nacitycoltem;Photo;NA;NA;2016-03-03T10:40:41Z;NA;0;0;0;0;0;0;0;0;0;0;0;0;0;0;0;0;0;0;0;0;0;0;0;0;0;0;NA;45;3726;35
417092451820846_447538975442860;https://www.facebook.com/lojascitycol/photos/a.447538952109529/447538975442860/?type=3;Croped Tam: P M G  R$ 17,99 Cód.: 876453;Photo;NA;NA;2016-03-03T09:52:39Z;NA;0;0;0;0;0;0;0;0;0;0;0;0;0;0;0;0;0;0;0;0;0;0;0;0;0;0;NA;NA;25;1
417092451820846_445812612282163;https://www.facebook.com/lojascitycol/videos/445812612282163/;Maria Joana em Duque de Caxias para lançamento da Coleção Lojas Citycol;Video;NA;NA;2016-02-26T14:09:25Z;NA;16286;15244;0;20793;19055;0;2405;2225;2427;2;2;6103;3900;0;0;904;3654;3806;0;0;6081;6643;0;0;0;15394;NA;10;279;10
417092451820846_445789305617827;https://www.facebook.com/lojascitycol/photos/a.418868384976586/445789305617827/?type=3;O lançamento da nova coleção foi um sucesso! Corre aqui para ver o que nós e a Maria Joana aprontamos na Citycol Duque de Caxias, você vai adorar.  #nacitycoltem Álbum: on.fb.me/1oEWM5p Vídeo: on.fb.me/1Q9amY5;Photo;NA;NA;2016-02-26T12:11:41Z;NA;0;0;0;0;0;0;0;0;0;0;0;0;0;0;0;0;0;0;0;0;0;0;0;0;0;0;NA;25;3854;50
417092451820846_445788418951249;https://www.facebook.com/lojascitycol/photos/a.445785655618192/445788418951249/?type=3;Nova Coleção Citycol;Photo;NA;NA;2016-02-26T12:06:23Z;NA;0;0;0;0;0;0;0;0;0;0;0;0;0;0;0;0;0;0;0;0;0;0;0;0;0;0;NA;6;26;6
417092451820846_445785872284837;https://www.facebook.com/lojascitycol/photos/a.445785655618192/445785872284837/?type=3;Nova Coleção Citycol;Photo;NA;NA;2016-02-26T11:52:31Z;NA;0;0;0;0;0;0;0;0;0;0;0;0;0;0;0;0;0;0;0;0;0;0;0;0;0;0;NA;1;29;NA
417092451820846_531464517050305;https://www.facebook.com/lojascitycol/photos/a.418868384976586/531464517050305/?type=3;"Que tal aproveitar o fim de semana para conferir as novidades na City mais próxima? ;) Essa é a nossa loja em Cachoeiro de Itapemirim, Espírito Santo.  #NaCitycolTem #modabarata #lookdodia #Citycol";Photo;NA;NA;2016-10-22T09:00:02Z;NA;0;0;0;0;0;0;0;0;0;0;0;0;0;0;0;0;0;0;0;0;0;0;0;0;0;0;Lifetime: The number of stories created about your Page post, by action type. (Total Count);34;4960;137
417092451820846_531464237050333;https://www.facebook.com/lojascitycol/photos/a.418868384976586/531464237050333/?type=3;E não dá para negar: a nossa Embaixadora @achadosfashion_rj arrasa demais! O look esporte com nosso vestido listrado ganhou o nosso coração! Amamos, Amandinha! <3   Vestido – R$29,99 Confira em nossas lojas.  #CityBloggers #NaCitycolTem #modabarata #lookdodia #Citycol #regram;Photo;NA;NA;2016-10-21T15:00:00Z;NA;0;0;0;0;0;0;0;0;0;0;0;0;0;0;0;0;0;0;0;0;0;0;0;0;0;0;NA;2;144;10
417092451820846_531464077050349;https://www.facebook.com/lojascitycol/photos/a.418868384976586/531464077050349/?type=3;Começando a sexta com essa fofura de regata! <3 R$13,99   Confira em nossas lojas. #NaCitycolTem #modabarata #lookdodia #Citycol;Photo;NA;NA;2016-10-21T06:00:00Z;NA;0;0;0;0;0;0;0;0;0;0;0;0;0;0;0;0;0;0;0;0;0;0;0;0;0;0;NA;29;3751;142
417092451820846_531463327050424;https://www.facebook.com/lojascitycol/photos/a.418868384976586/531463327050424/?type=3;"Nossa regata com estampa de cavalinhos está fazendo o maior sucesso. Quem mais amou também? ;) Regata – R$29,99 Confira.  #NaCitycolTem #modabarata #lookdodia #Citycol";Photo;NA;NA;2016-10-20T15:00:00Z;NA;0;0;0;0;0;0;0;0;0;0;0;0;0;0;0;0;0;0;0;0;0;0;0;0;0;0;NA;23;3085;80
417092451820846_531462573717166;https://www.facebook.com/lojascitycol/photos/a.418868384976586/531462573717166/?type=3;A @niteroiensebasica arrasou com as nossas jardineiras! <3 Jardineira - R$49,99 Compre em nossas lojas.  #CityBloggers #NaCitycolTem #modabarata #lookdodia #Citycol #regram;Photo;NA;NA;2016-10-20T06:00:01Z;NA;0;0;0;0;0;0;0;0;0;0;0;0;0;0;0;0;0;0;0;0;0;0;0;0;0;0;NA;21;640;55
417092451820846_531461440383946;https://www.facebook.com/lojascitycol/photos/a.418868384976586/531461440383946/?type=3;Nossa loja de Cachoeiro de Itapemirim, no Espírito Santo, está repleta de novidades em Jeans. Confira!  #CachoeirodeItapemirim #ES #NaCitycolTem #modabarata #lookdodia #Citycol #Jeans;Photo;NA;NA;2016-10-19T15:00:00Z;NA;0;0;0;0;0;0;0;0;0;0;0;0;0;0;0;0;0;0;0;0;0;0;0;0;0;0;NA;5;549;37
417092451820846_531461047050652;https://www.facebook.com/lojascitycol/photos/a.418868384976586/531461047050652/?type=3;"De pertinho! ;)   Confira em nossas lojas. Regata – R$29,99 #NaCitycolTem #modabarata #lookdodia #Citycol";Photo;NA;NA;2016-10-19T06:00:00Z;NA;0;0;0;0;0;0;0;0;0;0;0;0;0;0;0;0;0;0;0;0;0;0;0;0;0;0;NA;29;3907;108
417092451820846_531460857050671;https://www.facebook.com/lojascitycol/photos/a.418868384976586/531460857050671/?type=3;Os detalhes da gola fazem toda diferença no look do dia. Regata - R$29,99.   Confira em nossas lojas. #NaCitycolTem #modabarata #lookdodia #Citycol;Photo;NA;NA;2016-10-18T15:00:00Z;NA;0;0;0;0;0;0;0;0;0;0;0;0;0;0;0;0;0;0;0;0;0;0;0;0;0;0;NA;37;4667;131
417092451820846_531084973754926;https://www.facebook.com/lojascitycol/photos/a.418868384976586/531084973754926/?type=3;A Gabi @achadosdagabs arrasou no look all jeans com a nossa batinha! <3  #CityBloggers #NaCitycolTem #modabarata #lookdodia #Citycol #regram;Photo;NA;NA;2016-10-18T06:00:00Z;NA;0;0;0;0;0;0;0;0;0;0;0;0;0;0;0;0;0;0;0;0;0;0;0;0;0;0;NA;4;251;3
417092451820846_531084347088322;https://www.facebook.com/lojascitycol/photos/a.418868384976586/531084347088322/?type=3;Pode morrer de amores? <3 Confira em nossas lojas já! R$19,99. #NaCitycolTem #modabarata #lookdodia #Citycol;Photo;NA;NA;2016-10-17T15:00:00Z;NA;0;0;0;0;0;0;0;0;0;0;0;0;0;0;0;0;0;0;0;0;0;0;0;0;0;0;NA;9;475;18
417092451820846_529662203897203;https://www.facebook.com/lojascitycol/photos/a.418868384976586/529662203897203/?type=3;Começando a semana com a linda @marianamorenoo que arrasou com nosso vestido listrado! <3  #CityBloggers #NaCitycolTem #modabarata #lookdodia #Citycol #ModaPlusSize;Photo;NA;NA;2016-10-17T06:00:01Z;NA;0;0;0;0;0;0;0;0;0;0;0;0;0;0;0;0;0;0;0;0;0;0;0;0;0;0;NA;8;335;16
417092451820846_526621697534587;https://www.facebook.com/lojascitycol/photos/a.418868384976586/526621697534587/?type=3;Detalhes que a gente adora mostrar pra vocês! <3  Regatinha - R$29,99 #NaCitycolTem #modabarata #lookdodia #Citycol;Photo;NA;NA;2016-10-16T13:00:01Z;NA;0;0;0;0;0;0;0;0;0;0;0;0;0;0;0;0;0;0;0;0;0;0;0;0;0;0;NA;2;216;2
417092451820846_526621610867929;https://www.facebook.com/lojascitycol/photos/a.418868384976586/526621610867929/?type=3;Que tal nossa regata de cafezinhos para o look desse sábado?  R$29,99 #NaCitycolTem #modabarata #lookdodia #Citycol;Photo;NA;NA;2016-10-15T10:00:04Z;NA;0;0;0;0;0;0;0;0;0;0;0;0;0;0;0;0;0;0;0;0;0;0;0;0;0;0;NA;3;306;7
417092451820846_526620957534661;https://www.facebook.com/lojascitycol/photos/a.418868384976586/526620957534661/?type=3;Sexta é dia de alegria! :) Estampa apaixonante da nossa regatinha que tem aquele precinho que a gente ama! <3 R$13,99 #NaCitycolTem #modabarata #lookdodia #Citycol;Photo;NA;NA;2016-10-14T16:00:00Z;NA;0;0;0;0;0;0;0;0;0;0;0;0;0;0;0;0;0;0;0;0;0;0;0;0;0;0;NA;4;185;3
417092451820846_526620630868027;https://www.facebook.com/lojascitycol/photos/a.418868384976586/526620630868027/?type=3;Muita cor pra esse verão. Regatinha Plus Size – R$12,99 Confira em nossas lojas. #NaCitycolTem #modabarata #lookdodia #Citycol #PlusSize #ModaPlus;Photo;NA;NA;2016-10-14T07:00:01Z;NA;0;0;0;0;0;0;0;0;0;0;0;0;0;0;0;0;0;0;0;0;0;0;0;0;0;0;NA;6;168;5
417092451820846_526620404201383;https://www.facebook.com/lojascitycol/photos/a.418868384976586/526620404201383/?type=3;Fofura de detalhes. Regatinha – R$29,99 Confira em nossas lojas. #NaCitycolTem #modabarata #lookdodia #Citycol;Photo;NA;NA;2016-10-13T16:00:01Z;NA;0;0;0;0;0;0;0;0;0;0;0;0;0;0;0;0;0;0;0;0;0;0;0;0;0;0;NA;10;324;5
417092451820846_526620134201410;https://www.facebook.com/lojascitycol/photos/a.418868384976586/526620134201410/?type=3;Pra florir e encantar o seu dia! =) R$29,99 Confira em nossas lojas. #NaCitycolTem #modabarata #lookdodia #Citycol;Photo;NA;NA;2016-10-13T07:01:10Z;NA;0;0;0;0;0;0;0;0;0;0;0;0;0;0;0;0;0;0;0;0;0;0;0;0;0;0;NA;9;430;8
417092451820846_526619934201430;https://www.facebook.com/lojascitycol/photos/a.418868384976586/526619934201430/?type=3;O comprimento mídi tá com tudo e a nossa embaixadora @achadosfashion_rj usa e abusa dele com muito estilo.  A gente ama! Vestido – R$29,99 Confira em nossas lojas.   #CityBloggers #NaCitycolTem #modabarata #lookdodia #Citycol #regram;Photo;NA;NA;2016-10-12T16:00:01Z;NA;0;0;0;0;0;0;0;0;0;0;0;0;0;0;0;0;0;0;0;0;0;0;0;0;0;0;NA;9;246;17
