417092451820846_1338191293044286;https://www.facebook.com/lojascitycol/posts/1338191293044286;Hojé é #DiaDosNamorados, nós vamos celebrar junto com o casal Andressa, da Citycol Madureira, e Reginaldo, da Citycol Taquara. Histórias como essas que nos inspiram e nos enchem de alegria. Feliz Dia dos Namorados a todos! 🥰;Video;NA;NA;2020-06-12T10:00:05Z;NA;7101;7101;0;10115;10115;0;238;191;236;1;1;6767;4848;0;0;127;89;92;0;0;1324;1441;0;0;8028;161354;NA;6;115;65
417092451820846_1338140439716038;https://www.facebook.com/lojascitycol/photos/a.418868384976586/1338140439716038/?type=3;O Dia dos Namorados chegou! Já garantiu o presente Citycol para seu amor? Corre que ainda dá tempo!  . Blusa Polo Masculina - 19,99 - 54.01.0099 - Tam. P ao GG . Blusa Feminina - 13,99 - 43.04.0373 - Tam. G1 ao G3 . Nossas lojas abertas até hoje, dia 12/6 são: . Alcântara-RJ, Barra Mansa-RJ, Bom Jesus do Itabapoana-RJ, Cabo Frio-RJ, Cachoeiro de Itapemirim-ES, Campo Grande 2-RJ,  Colatina-ES, Duque de Caxias-RJ, Guadalupe-RJ, Itaperuna-RJ, Jauru-RJ, Linhares-ES, Montes Claros-MG, Maricá-RJ, Nilópolis-RJ, Queimados-RJ, Resende-RJ, São Gonçalo-RJ, São Mateus-ES, Seropédica-RJ,  Valença-RJ, Vitória-ES e Volta Redonda-RJ.;Photo;NA;NA;2020-06-12T08:39:46Z;NA;4924;4924;0;5772;5772;0;108;65;69;0;0;4376;3776;0;0;103;0;0;0;0;0;0;0;0;0;0;NA;NA;52;3
417092451820846_1338059189724163;https://www.facebook.com/lojascitycol/photos/a.418868384976586/1338059189724163/?type=3;Feliz Dia Dos Namorados! 😍😍😍 # #DiaDosNamorados;Photo;NA;NA;2020-06-12T06:56:12Z;NA;3948;3948;0;4731;4731;0;64;22;25;0;0;3286;2776;0;0;54;0;0;0;0;0;0;0;0;0;0;NA;2;45;NA
417092451820846_1337652036431545;https://www.facebook.com/lojascitycol/posts/1337652036431545;Hoje contamos a história do casal Leiliele, da Citycol Bangu 1,  e Jhonata, da Citycol Campo Grande 1. Eles são a prova que um romance que começa nas redes sociais pode dar até em casamento e na formação de uma família. Estamos muito felizes de fazer parte de história! Falta 1 dia! #DiaDosNamorados é na Citycol 😍;Video;NA;NA;2020-06-11T18:06:16Z;NA;4724;4724;0;5670;5670;0;91;75;78;0;0;4228;3471;0;0;85;25;25;0;0;835;861;0;0;4703;115054;NA;NA;27;3
417092451820846_1337411623122253;https://www.facebook.com/lojascitycol/posts/1337411623122253;Deixou para comprar o presente pro mozão na última hora? 🤔❤ #VemPraCity garantir vários modelos de Polo por só 19,99. #DiaDosNamorados é na Citycol!  . Blusa polo 19,99 - 54.01.0099 - Tam. P ao GG;Photo;NA;NA;2020-06-11T10:50:18Z;NA;7031;7031;0;8314;8314;0;544;486;556;0;0;6629;5657;0;0;490;0;0;0;0;0;0;0;0;0;0;NA;5;101;25
417092451820846_1336889279841154;https://www.facebook.com/lojascitycol/posts/1336889279841154;Entrando no clima do Dia dos Namorados, apresentamos pra vocês  casais unidos pela Citycol. Hoje contamos a bela história de Stefany, da Citycol Niterói,  e Lucas,  da Citycol São Gonçalo. Faltam só 2 dias! 😍 #DiaDosNamorados é na Citycol!;Video;NA;NA;2020-06-10T18:56:43Z;NA;5733;5733;0;6933;6933;0;167;143;171;1;1;5161;4235;0;0;140;44;45;0;0;1175;1273;0;0;6964;167182;NA;3;55;14
417092451820846_1336545719875510;https://www.facebook.com/lojascitycol/photos/a.418868384976586/1336545719875510/?type=3;Dica da Mey Leng Consultora de Moda: 👙❤ Conjunto de calcinha e sutiã com detalhe de renda é um clássico das lingeries. A renda é famosa por realçar a sensualidade e deixar as mulheres muito mais delicadas e elegantes. A CITYCOL tem diferentes cores e modelos de conjuntos de lingerie para o seu DIA dos NAMORADOS. . Lingeries lindas e românticas? #NaCitycolTem 🥰  Conjuntos em cores diversas a partir de R$ 19,99 Vem pra City!💙💛 #diadosnamorados  #modabarata;Photo;NA;NA;2020-06-10T08:46:32Z;NA;5003;5003;0;5727;5727;0;153;97;109;0;0;4334;3720;0;0;143;0;0;0;0;0;0;0;0;0;0;NA;1;69;5
417092451820846_1335743609955721;https://www.facebook.com/lojascitycol/photos/a.418868384976586/1335743609955721/?type=3;LIVE , HOJE, 17 hs - Amor & Cozinha - com a City Blogger @marianamorenoo e o seu namorado Ricardo Almeida, que cozinharão AO VIVO- um risoto com calabresa e darão dicas de ROUPAS da CITYCOL e uma receita de amor  para o DIA dos NAMORADOS! Não perca amanhã ! 17 hs !;Photo;NA;NA;2020-06-09T08:28:37Z;NA;3350;3350;0;3893;3893;0;18;8;9;0;0;2544;2158;0;0;18;0;0;0;0;0;0;0;0;0;0;NA;NA;11;NA
417092451820846_1335581346638614;https://www.facebook.com/lojascitycol/photos/a.418868384976586/1335581346638614/?type=3;A Citycol Cachoeiro de Itapemirim -ES já está pronta pra te receber! Confira as novidades do Inverno para o seu namorado💗 . A Citycol tem lojas em vários municípios pelo Brasil e, respeitando as recomendações de segurança e saúde, algumas de nossas lojas já estão abertas com autorização da prefeitura local, enquanto nas demais cidades, ainda aguardamos a liberação do governo local  para reabertura. . Nossas lojas abertas até hoje , dia 9/6 são: . Barra Mansa-RJ, Cabo Frio-RJ, Cachoeiro de Itapemirim-ES, Colatina-ES, Duque de Caxias-RJ, Itaperuna-RJ, Linhares-ES, Montes Claros-MG, Maricá-RJ, Nilópolis-RJ, Queimados-RJ, Resende-RJ, São João de Meriti-RJ, São Mateus-ES, Seropédica-RJ,  Valença-RJ, Vitória-ES e Volta Redonda-RJ.;Photo;NA;NA;2020-06-09T04:34:49Z;NA;5417;5417;0;6238;6238;0;205;136;147;2;2;4841;4082;0;0;193;0;0;0;0;0;0;0;0;0;0;NA;1;82;24
417092451820846_1335266940003388;https://www.facebook.com/lojascitycol/photos/a.418868384976586/1335266940003388/?type=3;A Citycol Cachoeiro de Itapemirim -ES já está pronta pra te receber! Confira as novidades do Inverno para o seu namorado💗 . A Citycol tem lojas em vários municípios pelo Brasil e, respeitando as recomendações de segurança e saúde, algumas de nossas lojas já estão abertas com autorização da prefeitura local, enquanto nas demais cidades, ainda aguardamos a liberação do governo local  para reabertura. . Nossas lojas abertas até hoje , dia 8/6 são: . Barra Mansa-RJ, Cabo Frio-RJ, Cachoeiro de Itapemirim-ES, Colatina-ES, Duque de Caxias-RJ, Itaperuna-RJ, Linhares-ES, Montes Claros-MG, Maricá-RJ, Nilópolis-RJ, Queimados-RJ, Resende-RJ, São João de Meriti-RJ, São Mateus-ES, Seropédica-RJ,  Valença-RJ, Vitória-ES e Volta Redonda-RJ.;Photo;NA;NA;2020-06-08T17:35:13Z;NA;4957;4957;0;5838;5838;0;203;117;134;0;0;4467;3726;0;0;194;0;0;0;0;0;0;0;0;0;0;NA;2;99;8
417092451820846_1335251606671588;https://www.facebook.com/lojascitycol/posts/1335251606671588;LIVE , AMANHÃ, 17 hs - Amor & Cozinha - com a City Blogger @marianamorenoo e o seu namorado Ricardo Almeida, que cozinharão AO VIVO- um risoto com calabresa e darão dicas de ROUPAS da CITYCOL e uma receita de amor  para o DIA dos NAMORADOS! Não perca amanhã ! 17 hs !;Video;NA;NA;2020-06-08T17:04:51Z;NA;3192;3192;0;4260;4260;0;36;17;18;1;1;2679;1967;0;0;33;85;89;0;0;609;644;0;0;2947;15092;NA;NA;20;NA
417092451820846_1335149436681805;https://www.facebook.com/lojascitycol/photos/a.418868384976586/1335149436681805/?type=3;Um casaco de moletom é garantia de bem-estar e você pode estar na moda sem abrir mão do conforto. Dá para usar em casa, no trabalho e ainda montar produções poderosas para garantir um estilo  fashion. Foto : casaco com capuz e bolso canguru - Tamanhos : P M G GG - R$59,99;Photo;NA;NA;2020-06-08T13:50:17Z;NA;4443;4443;0;5015;5015;0;111;56;63;2;2;3763;3211;0;0;105;0;0;0;0;0;0;0;0;0;0;NA;NA;63;5
417092451820846_1335140770016005;https://www.facebook.com/lojascitycol/photos/a.418868384976586/1335140770016005/?type=3;LIVE , AMANHÃ, 17 hs - Amor & Cozinha - com a City Blogger @marianamorenoo e o seu namorado Ricardo Almeida, que cozinharão AO VIVO- um risoto com calabresa e darão dicas de ROUPAS da CITYCOL e uma receita de amor  para o DIA dos NAMORADOS! Não perca amanhã ! 17 hs !;Photo;NA;NA;2020-06-08T13:31:24Z;NA;3391;3391;0;3961;3961;0;40;15;17;0;0;2503;2138;0;0;30;0;0;0;0;0;0;0;0;0;0;NA;1;32;2
417092451820846_1334428066753942;https://www.facebook.com/lojascitycol/posts/1334428066753942;A Citycol São Mateus já esta pronta pra te receber! Confira as novidades do Inverno 🧥💗 . A Citycol tem lojas em vários municípios pelo Brasil e, respeitando as recomendações de segurança e saúde, algumas de nossas lojas já estão abertas com autorização da prefeitura local, enquanto nas demais cidades, ainda aguardamos a liberação do governo local  para reabertura. . Nossas lojas abertas até hoje , dia 7/6 são: . Barra Mansa-RJ, Cabo Frio-RJ, Cachoeiro de Itapemirim-ES, Colatina-ES, Duque de Caxias-RJ, Itaperuna-RJ, Linhares-ES, Montes Claros-MG, Maricá-RJ, Nilópolis-RJ, Queimados-RJ, Resende-RJ, São João de Meriti-RJ, São Mateus-ES, Seropédica-RJ,  Valença-RJ, Vitória-ES e Volta Redonda-RJ;Photo;NA;NA;2020-06-07T15:04:07Z;NA;17344;17344;0;20373;20373;0;2441;2234;2594;2;2;17199;14541;0;0;2219;0;0;0;0;0;0;0;0;0;0;NA;13;418;70
417092451820846_1333973030132779;https://www.facebook.com/lojascitycol/posts/1333973030132779;Roupa confortável para aproveitar o sofá com Netflix 📺 #NaCitycolTem #DiaDosNamorados 💟 . Blusa: 17,99 - 43.05.0312 - Tam. G1 ao G3 . Short: 29,99 - 48.01.0149 - Tam. G1 ao G3;Photo;NA;NA;2020-06-07T01:43:59Z;NA;3873;3873;0;4393;4393;0;87;55;63;1;1;3124;2715;0;0;80;0;0;0;0;0;0;0;0;0;0;NA;1;37;2
417092451820846_1332857546910994;https://www.facebook.com/lojascitycol/posts/1332857546910994;Comunicado aos colaboradores da fábrica de Três Rios:  Entre os dias 8 e 12 de Junho, estaremos funcionando somente com parte dos nossos colaboradores, devidamente comunicados.   Os colaboradores que não estão escalados para trabalhar nesses dias, seguindo a medida provisória 936, sempre com o intuito de preservar empregos, terão a jornada de trabalho reduzida conforme acordo coletivo e entrarão em regime de banco de horas.  Nosso retorno às atividades segue todos protocolos de saúde e segurança determinados pelas autoridades locais.  Juntos somos mais fortes!;Photo;NA;NA;2020-06-05T15:51:35Z;NA;12288;12288;0;14837;14837;0;967;910;1321;1;2;10768;8824;0;0;678;0;0;0;0;0;0;0;0;0;0;NA;20;120;32
417092451820846_1332125673650848;https://www.facebook.com/lojascitycol/posts/1332125673650848;Role ➡️ DIA dos NAMORADOS 💝 - Encontre na CITYCOL diferentes cores de lingerie para variar todos os dias. Inspire-se com uma lingerie vermelha bem sensual em um dia e uma lingerie preta mais elegante no outro! Prefere cores mais neutras e claras? As lingeries rosa e  branca são as melhores opções nesse caso.;Photo;NA;NA;2020-06-04T18:15:06Z;NA;5683;5683;0;6533;6533;0;404;353;414;1;1;5108;4357;0;0;384;0;0;0;0;0;0;0;0;0;0;NA;NA;83;12
417092451820846_1331254830404599;https://www.facebook.com/lojascitycol/posts/1331254830404599;Role ➡️ A Citycol Vitória já está com roupas para seu Dia dos Namorados💘 Também temos linha Inverno para as crianças.  . Algumas de nossas lojas já estão abertas,  venha conferir a nova coleção! . A Citycol tem lojas em vários municípios pelo Brasil e, respeitando as recomendações de segurança e saúde, algumas de nossas lojas já estão abertas com autorização da prefeitura local, enquanto nas demais cidades, ainda aguardamos a liberação do governo local  para reabertura. . Nossas lojas abertas até hoje dia 03/06 são: . Barra Mansa-RJ, Cachoeiro de Itapemirim-ES, Colatina-ES, Itaperuna-RJ, Linhares-ES, Maricá-RJ, Montes Claros-MG, Resende-RJ, São Mateus-ES,  Vitória-ES e Volta Redonda-RJ.;Photo;NA;NA;2020-06-03T16:06:17Z;NA;11604;11604;0;14081;14081;0;1684;1578;1970;2;2;11408;9559;0;0;1537;0;0;0;0;0;0;0;0;0;0;NA;7;248;42
417092451820846_1330507347146014;https://www.facebook.com/lojascitycol/photos/a.418868384976586/1330507347146014/?type=3;Dica da Consultora de Moda Mey Leng: Qual é a mulher que não gosta de ter um corpo bem definido? Depois de muitos dias em casa e com aqueles quilinhos a mais .... Usar uma corpetes, cintas e bermudas  modeladoras podem fazer a diferença, tanto no seu look, como para a  sua auto-estima.  Aproveite os diferentes modelos disponíveis nas lojas Citycol.;Photo;NA;NA;2020-06-02T16:55:45Z;NA;7751;7751;0;9070;9070;0;383;306;379;1;1;7418;6331;0;0;359;0;0;0;0;0;0;0;0;0;0;NA;1;118;26
417092451820846_1330019857194763;https://www.facebook.com/lojascitycol/photos/a.418868384976586/1330019857194763/?type=3;🌱🌷Algo muito interessante vem acontecendo nos últimos dias: muitas pessoas começaram a cultivar uma horta em casa durante a pandemia.  Agora, terraços, varandas e janelas têm pequenos canteiros onde crescem mudas tímidas. Plantas que, com cuidado, dedicação e paciência, se transformarão em vegetais prontos para o consumo. . Dando continuidade as nossas LIVES de DIA dos NAMORADOS, amanhã,  3a feira, dia 02/06,  às 18h, receberemos o CASAL DARLAN e LETÍCIA, especialistas no Cultivo  de PLANTAS para DENTRO de CASA. Eles tem o atelier @davaranda.design .;Photo;NA;NA;2020-06-02T03:58:20Z;NA;3407;3407;0;3920;3920;0;22;12;13;0;0;2479;2041;0;0;16;0;0;0;0;0;0;0;0;0;0;NA;NA;10;NA
417092451820846_1329730693890346;https://www.facebook.com/lojascitycol/photos/a.418868384976586/1329730693890346/?type=3;🌱🌷Algo muito interessante vem acontecendo nos últimos dias: muitas pessoas começaram a cultivar uma horta em casa durante a pandemia.  Agora, terraços, varandas e janelas têm pequenos canteiros onde crescem mudas tímidas. Plantas que, com cuidado, dedicação e paciência, se transformarão em vegetais prontos para o consumo. . Dando continuidade as nossas LIVES de DIA dos NAMORADOS, amanhã,  3a feira, dia 02/06,  às 18h, receberemos o CASAL DARLAN e LETÍCIA, especialistas no Cultivo  de PLANTAS para DENTRO de CASA. Eles tem o atelier @davaranda.design .;Photo;NA;NA;2020-06-01T17:36:22Z;NA;3618;3618;0;4084;4084;0;28;11;11;2;2;2718;2307;0;0;25;0;0;0;0;0;0;0;0;0;0;NA;NA;18;NA
417092451820846_1329446793918736;https://www.facebook.com/lojascitycol/photos/a.418868384976586/1329446793918736/?type=3;Espalhe amor por aí!♥️ #Diadosnamorados tá chegando! Já garantiu seu presente na City? #CitycomAmor;Photo;NA;NA;2020-06-01T08:53:52Z;NA;5140;5140;0;5718;5718;0;122;67;80;1;1;4261;3618;0;0;107;0;0;0;0;0;0;0;0;0;0;NA;1;56;8
417092451820846_1328944217302327;https://www.facebook.com/lojascitycol/photos/a.418868384976586/1328944217302327/?type=3;🌱🌷Algo muito interessante vem acontecendo nos últimos dias: muitas pessoas começaram a cultivar uma horta em casa durante a pandemia.   Agora, terraços, varandas e janelas têm pequenos canteiros onde crescem mudas tímidas. Plantas que, com cuidado, dedicação e paciência, se transformarão em vegetais prontos para o consumo. . Dando continuidade as nossas LIVES de DIA dos NAMORADOS, na 3a feira, dia 02/06,  receberemos o CASAL DARLAN E LETÍCIA, especialistas no Cultivo  de PLANTAS para DENTRO de CASA. Eles tem o atelier @davaranda.design .;Photo;NA;NA;2020-05-31T17:00:16Z;NA;3666;3666;0;4135;4135;0;30;8;8;0;0;2750;2366;0;0;26;0;0;0;0;0;0;0;0;0;0;NA;NA;22;NA
417092451820846_1328884337308315;https://www.facebook.com/lojascitycol/posts/1328884337308315;FESTIVAL DE INVERNO CITYCOL – DIA dos NAMORADOS - Qual a melhor combinação ? 👗👘  Complemente seu Vestido  com um Kimono CITYCOL ou uma meia calça e um sapato mais fechado, como as botinhas de cano curto ou com tênis para um estilo esportivo. Além de romântica,  a sua  produção fica confortável com um ar de leveza.;Photo;NA;NA;2020-05-31T15:04:30Z;NA;12537;12537;0;14954;14954;0;1823;1732;1998;3;3;13229;11028;0;0;1749;0;0;0;0;0;0;0;0;0;0;NA;2;255;47
417092451820846_1327825014080914;https://www.facebook.com/lojascitycol/photos/a.418868384976586/1327825014080914/?type=3;Dia dos Namorados: Roupa para seu amor você encontra na Citycol! 💘 . Camisa Social Jeans - 59,99 - 38.01.0819  - Tam. P ao GG . . Camisa T-Shirt - 25,99 - 56.01.0658 - Tam. P ao GG - Cores variadas . . Calça Jeans a partir de 49,99.;Photo;NA;NA;2020-05-30T08:04:00Z;NA;4399;4399;0;5084;5084;0;98;64;75;0;0;3647;3140;0;0;93;0;0;0;0;0;0;0;0;0;0;NA;NA;40;8
417092451820846_1327250834138332;https://www.facebook.com/lojascitycol/posts/1327250834138332;Assista nossa estreia. 💥 Apresentamos as novidades de Inverno da Semana e sugestões para o DIA DOS NAMORADOS 😍. . A Citycol tem lojas em vários municípios pelo Brasil e, respeitando as recomendações de segurança e saúde, algumas de nossas lojas já estão abertas com liberação da prefeitura local, enquanto nas demais cidades, ainda aguardamos termos condições plenas para reabertura.  . Nossas lojas abertas até hoje , dia 29/05, são: .. Barra Mansa-RJ, Cachoeiro de Itapemirim-ES, Colatina-ES, Linhares-ES, Montes Claros-MG, Resende-RJ, São Mateus-ES, Teixeira de Freitas-BA, Vitória-ES e Volta Redonda-RJ.  . *Na próxima 2ª feira, 01/06, serão abertas todas lojas de Duque de Caxias-RJ.;Video;NA;NA;2020-05-29T13:42:35Z;NA;5537;5537;0;7883;7883;0;180;139;144;1;1;5656;3900;0;0;155;16;16;0;0;1100;1218;0;0;10500;433537;NA;1;54;4
417092451820846_1326991450830937;https://www.facebook.com/lojascitycol/photos/a.418868384976586/1326991450830937/?type=3;HOJE, às 17 hs AO VIVO, estreamos a FLASH LIVE CITYCOL💥 aqui nas @lojas_citycol. Apresentaremos as novidades de Inverno da Semana e sugestões para o DIA DOS NAMORADOS. Até já! 😍;Photo;NA;NA;2020-05-29T07:00:22Z;NA;3739;3739;0;4257;4257;0;66;35;37;0;0;2878;2484;0;0;62;0;0;0;0;0;0;0;0;0;0;NA;2;35;1
417092451820846_1326579170872165;https://www.facebook.com/lojascitycol/photos/a.418868384976586/1326579170872165/?type=3;Amanhã, 6a às 17 hs AO VIVO, estreamos a FLASH LIVE CITYCOL💥 no Instagram @lojas_citycol. Apresentaremos as novidades de Inverno da Semana e sugestões para o DIA DOS NAMORADOS. Até já! 😍;Photo;NA;NA;2020-05-28T17:45:16Z;NA;4924;4924;0;5735;5735;0;146;108;132;0;0;4292;3660;0;0;135;0;0;0;0;0;0;0;0;0;0;NA;NA;50;11
417092451820846_1326318767564872;https://www.facebook.com/lojascitycol/posts/1326318767564872;Dica da Consultora de Moda  Mey Leng: A partir desta semana começa o FESTIVAL DE INVERNO CITYCOL ! .. Quando o inverno chega, nada melhor do que renovar o nosso guarda-roupa com produtos, BÁSICOS e CONFORTÁVEIS, que são essenciais para nos manter aquecidas e estilosas.  .. Invista no MOLETOM o  material queridinho da estação e veja nas fotos a variedade de  CALÇAS ADULTO UNISSEX , INFANTIL e JUVENIL, que a CITYCOL escolheu para você. .. Na sexta-feira, dia 29/5, às 17 hs, estaremos AO VIVO, aqui no instagram, com a LIVE FLASH CITYCOL e serão apresentadas as novidades de inverno da semana. Até lá! 😊;Photo;NA;NA;2020-05-28T10:47:17Z;NA;10605;10605;0;12395;12395;0;1288;1229;1498;1;1;10697;9160;0;0;1214;0;0;0;0;0;0;0;0;0;0;NA;NA;139;42
417092451820846_1325755750954507;https://www.facebook.com/lojascitycol/photos/a.418868384976586/1325755750954507/?type=3;Seu look pode ser simples e estiloso! 💁🏽 Experimente nossa blusa que realça seus ombros. . Blusa: 17,99 - 35.06.0758 - Tam. P ao G - Cores variadas. .. Calça Jeans a partir de 49,99 - Tamanhos variados .;Photo;NA;NA;2020-05-27T16:20:05Z;NA;7636;7636;0;8815;8815;0;245;186;207;2;2;7196;6304;0;0;235;0;0;0;0;0;0;0;0;0;0;NA;1;75;36
417092451820846_1325069367689812;https://www.facebook.com/lojascitycol/posts/1325069367689812;Role ➡️ Gostaria de deixar o seu visual  mais interessante com uma terceira peça? Um kimono estampado ou kimono colorido pode te ajudar! Outro modelo que faz bastante sucesso e garante um efeito incrível para o seu look é o kimono longo. O comprimento dessa peça vai  até a região do quadril , criando um efeito alongado e deixando a sua produção ainda mais estilosa.   A CITYCOL preparou um FESTIVAL de KIMONOS para este INVERNO em diversos  tamanhos : P, M, G, GG, G1 e G2.;Photo;NA;NA;2020-05-26T17:23:31Z;NA;9136;9136;0;10884;10884;0;934;855;1070;0;0;9064;7682;0;0;867;0;0;0;0;0;0;0;0;0;0;NA;4;177;33
417092451820846_1324698404393575;https://www.facebook.com/lojascitycol/photos/a.418868384976586/1324698404393575/?type=3;LIVE HOJE , terça 26/5 , 18 hs, com a maquiadora e estilista @natarmstrong_makeup que ensinará e fará uma maquiagem apropriada para o inverno e ao vivo !!! Além disso, conversará com a consultora de moda Mey Leng sobre as tendências de bijuterias para o inverno 2020, aqui nas @Lojas_Citycol . Até lá !!!;Photo;NA;NA;2020-05-26T06:09:39Z;NA;3499;3499;0;4114;4114;0;29;15;16;0;0;2633;2270;0;0;24;0;0;0;0;0;0;0;0;0;0;NA;NA;16;2
417092451820846_1324142574449158;https://www.facebook.com/lojascitycol/photos/a.418868384976586/1324142574449158/?type=3;Parabéns a todas costureiras! ✂️🧵  . Obrigada por criarem e materializarem nossos sonhos em forma de roupas lindas para nossas clientes! A Citycol agradece em especial à sua equipe, por todo seu comprometimento e dedicação ao longo dos anos . . Juntos somos mais fortes!;Photo;NA;NA;2020-05-25T11:39:41Z;NA;5947;5947;0;6899;6899;0;193;113;122;0;0;4621;4010;0;0;145;0;0;0;0;0;0;0;0;0;0;NA;8;120;22
417092451820846_1324030671127015;https://www.facebook.com/lojascitycol/photos/a.418868384976586/1324030671127015/?type=3;Uma calça moderna e cheia de estilo, indispensável pro seu guarda roupa!👖✨ .. Invista nesse jeans confortável, com passantes para o seu cinto, leve ajuste na barra e com o detalhe de botões, que dá um charme a mais pro seu look!   ..  Calça Jeans - 49,99 - 39.01.0063 - Tam. 38 ao 46;Photo;NA;NA;2020-05-25T09:04:09Z;NA;4374;4374;0;4930;4930;0;107;48;51;0;0;3447;3006;0;0;100;0;0;0;0;0;0;0;0;0;0;NA;1;67;2
417092451820846_1323972994466116;https://www.facebook.com/lojascitycol/photos/a.418868384976586/1323972994466116/?type=3;Live , amanhã , terça , 26/5 com a maquiadora e estilista @natarmstrong_makeup que ensinará e fará uma maquiagem de inverno ao vivo . Além disso, conversará com a consultora de moda Mey Leng sobre as tendências de bijuterias para o inverno 2020.;Photo;NA;NA;2020-05-25T07:35:41Z;NA;3386;3386;0;3956;3956;0;24;9;10;0;0;2530;2193;0;0;20;0;0;0;0;0;0;0;0;0;0;NA;1;16;1
417092451820846_1323566194506796;https://www.facebook.com/lojascitycol/posts/1323566194506796;Dica da Mey Leng Consultora de Moda: 👖Toda CRIANÇA precisa ter muita liberdade de movimento para brincar e descobrir o mundo ao seu redor. .. O INVERNO está chegando e é de extrema importância que ela vista calças infantis, que lhe ofereçam o máximo de bem-estar e as deixe livre para executar os seus movimentos sem incômodos. .. Foi pensando nisso que a CITYCOL escolheu uma coleção de calças infantis - produtos com muito conforto e estilo, nos materiais :  tactel, helanca e moletom , nos tamanhos 4, 6 e 8. .. Calça Moletom Infantil - 12,99 - Tam. 4, 6 e 8 - Cores diversas. .. Calça Tactel Infantil - 14,99 - Tam. 4, 6 e 8 - Cores diversas. .. Calça Helanca Infantil - 29,99 - Tam. 4, 6 e 8 - Cores diversas.;Photo;NA;NA;2020-05-24T17:00:45Z;NA;4880;4880;0;5457;5457;0;199;161;190;0;0;3998;3515;0;0;181;0;0;0;0;0;0;0;0;0;0;NA;NA;53;8
417092451820846_1322530061277076;https://www.facebook.com/lojascitycol/photos/a.418868384976586/1322530061277076/?type=3;Tendência de Inverno é na Citycol!  👗🧥 . Vestido: 49,99 - 49.04.0047 - Tam. G1 e G2 - Estampas variadas. . Kimono: 34,99 - 38.05.0171 - Tam. P ao GG - Cores variadas.;Photo;NA;NA;2020-05-23T09:31:03Z;NA;4704;4704;0;5400;5400;0;94;55;59;2;2;3923;3412;0;0;91;0;0;0;0;0;0;0;0;0;0;NA;NA;46;7
417092451820846_1321208698075879;https://www.facebook.com/lojascitycol/posts/1321208698075879;Role ➡️ Dica da Consultora de Moda Mey Leng: Hoje o nosso assunto é especial, vamos falar da MALHA CREPE, que voltou com toda força ao cenário da moda.   .. A malha crepe tem um ótimo caimento para peças mais encorpadas, sua elasticidade ajuda a modelar o corpo de forma incrível. Tem o caimento pesado perfeito para todas as estações e sua textura pigmentada é de aspecto fosco. .. Não é por ser um tipo de malha que se trata de um tecido mais popular, pelo contrário, o crepe de malha é uma malha de requinte que, se usada da forma certa ela consegue ser muito elegante. .. A CITYCOL tem desenvolvido coleções de malha crepe estampada ou lisa, arraste a imagem ➡️ para ver a variedade de opções de produtos listrados do departamento PLUS , nos tamanhos G1 e G2 . Você vai amar ! . Jardineira 39,99 - Tam. G1 e G2 .. Macacão 49,99 - Tam. G1 e G2 .. Calça 39,99 - Tam. G1 e G2;Photo;NA;NA;2020-05-21T16:30:45Z;NA;4142;4142;0;4733;4733;0;129;99;110;0;0;3246;2831;0;0;119;0;0;0;0;0;0;0;0;0;0;NA;1;37;NA
417092451820846_1320523404811075;https://www.facebook.com/lojascitycol/photos/a.418868384976586/1320523404811075/?type=3;Na Citycol você monta seu estilo em qualquer estação! 🥰 . Regata - 19,99 - 43.07.0408 - Tam. G1 e G2 - Cores variadas  . Saia - 29,99 - 48.01.0206 - Tam. G1 ao G3 - Cores variadas;Photo;NA;NA;2020-05-20T18:18:12Z;NA;4219;4219;0;4824;4824;0;80;28;30;1;1;3307;2925;0;0;74;0;0;0;0;0;0;0;0;0;0;NA;NA;53;8
417092451820846_1319650044898411;https://www.facebook.com/lojascitycol/photos/a.418868384976586/1319650044898411/?type=3;Dica da Consultora de Moda Mey Leng: As blusas, vestidos, saias, pantacourts e macacões CITYCOL são feitos com a MALHA RADIOSA, que é extremamente versátil. A malha radiosa confere aos produtos um aspecto natural e um toque mais seco e juntamente com o fio da lycra torna as modelagens mais ajustadas ou fluídas.  .. As blusas em  radiosa com  MANGAS LONGAS, em cores diversas,  compõem a coleção de inverno da CITYCOL. E o frio já está chegando .....;Photo;NA;NA;2020-05-19T14:20:22Z;NA;4744;4744;0;5375;5375;0;98;56;60;2;2;3802;3355;0;0;88;0;0;0;0;0;0;0;0;0;0;NA;1;50;10
