417092451820846_689874114542677;https://www.facebook.com/lojascitycol/photos/a.418868384976586/689874114542677/?type=3;"Já estamos no mês do ""Outubro Rosa"", como é conhecido o movimento que utiliza o laço rosa como símbolo mundial da luta contra o câncer de mama. Não importa a sua cor preferida, neste mês troque-a por algum tom açucarado de cor-de-rosa ou um pink frenético.💓   E a boa razão para isso é a campanha de conscientização que ressalta a importância da prevenção e do diagnóstico precoce do câncer de mama. A City apoia essa causa. Previna-se, faça o exame!🎀💛💙 #OutubroRosa";Photo;NA;NA;2017-10-05T07:02:19Z;NA;0;0;0;0;0;0;0;0;0;0;0;0;0;0;0;0;0;0;0;0;0;0;0;0;0;0;NA;2;62;NA
417092451820846_689660154564073;https://www.facebook.com/lojascitycol/posts/689660154564073;Passem o dedo para o lado e deem uma espiadinha do que espera por vocês na nova loja do Centro!😍💙💛 #VemCityNovaporAí #ConceitoNovo #PrecinhodeSempre;Photo;NA;NA;2017-10-04T16:01:25Z;NA;0;0;0;0;0;0;0;0;0;0;0;0;0;0;0;0;0;0;0;0;0;0;0;0;0;0;NA;11;657;35
417092451820846_689487901247965;https://www.facebook.com/lojascitycol/photos/a.418868384976586/689487901247965/?type=3;Muito estilo para eles e com o precinho que só a City tem! 🙃 T-shirt: 24,99 | Regata: 19,99 | Bermudas: 29,99 #modabarata #NaCitycolTem #modamasculina #Verao2017Citycol;Photo;NA;NA;2017-10-04T07:01:57Z;NA;0;0;0;0;0;0;0;0;0;0;0;0;0;0;0;0;0;0;0;0;0;0;0;0;0;0;NA;2;169;5
417092451820846_689254194604669;https://www.facebook.com/lojascitycol/photos/a.418868384976586/689254194604669/?type=3;Nesta sexta-feira temos um encontro marcado, hein! Vamos adorar receber a visita de vocês!💙💛 #VemCityNovaporAí #ConceitoNovo #PrecinhodeSempre;Photo;NA;NA;2017-10-03T16:01:14Z;NA;0;0;0;0;0;0;0;0;0;0;0;0;0;0;0;0;0;0;0;0;0;0;0;0;0;0;NA;3;95;11
417092451820846_689122054617883;https://www.facebook.com/lojascitycol/photos/a.418868384976586/689122054617883/?type=3;Cores e listras para o #Verao2017Citycol!😍 Vestido: 29,99 | Regata: 12,99 | Saia: 22,99. Confira em nossas lojas!💙💛 #modabarata #NaCitycolTem;Photo;NA;NA;2017-10-03T07:01:09Z;NA;0;0;0;0;0;0;0;0;0;0;0;0;0;0;0;0;0;0;0;0;0;0;0;0;0;0;NA;6;936;54
417092451820846_688901664639922;https://www.facebook.com/lojascitycol/photos/a.418868384976586/688901664639922/?type=3;O conceito é novo, mas o precinho continua o de sempre!😉💙💛 Essa é a nossa loja que reinagura essa semana na rua da Alfândega, 225. #VemCityNovaporAí #conceitonovo #precinhodesempre;Photo;NA;NA;2017-10-02T16:01:12Z;NA;0;0;0;0;0;0;0;0;0;0;0;0;0;0;0;0;0;0;0;0;0;0;0;0;0;0;NA;9;396;35
417092451820846_688765047986917;https://www.facebook.com/lojascitycol/photos/a.418868384976586/688765047986917/?type=3;Começando a semana com flores e muito amor por esse vestido escolhido pela #CityBlogger Simone (@plusisters)!🌺😍 #NaCitycolTem #modabarata #lookdodia;Photo;NA;NA;2017-10-02T07:00:58Z;NA;0;0;0;0;0;0;0;0;0;0;0;0;0;0;0;0;0;0;0;0;0;0;0;0;0;0;NA;1;94;2
417092451820846_688529878010434;https://www.facebook.com/lojascitycol/photos/a.418868384976586/688529878010434/?type=3;A gente promete que falta pouquinho!! 🙏💛💙Durante a semana divulgaremos a data exata para vocês. 😉  #VemCityNovaporAí;Photo;NA;NA;2017-10-01T14:01:18Z;NA;0;0;0;0;0;0;0;0;0;0;0;0;0;0;0;0;0;0;0;0;0;0;0;0;0;0;NA;1;69;4
417092451820846_688027161394039;https://www.facebook.com/lojascitycol/photos/a.418868384976586/688027161394039/?type=3;Estamos morrendo de amores pela produção da Gabs (@achadosdagabs) com o nosso kimono queridinho!😍  #CityBlogger #Verao2017Citycol #modabarata #NaCitycolTem;Photo;NA;NA;2017-09-30T07:01:59Z;NA;0;0;0;0;0;0;0;0;0;0;0;0;0;0;0;0;0;0;0;0;0;0;0;0;0;0;NA;3;264;14
417092451820846_687803721416383;https://www.facebook.com/lojascitycol/photos/a.418868384976586/687803721416383/?type=3;Cores e mais cores da coleção Tropicana que chegou na loja do Méier da rua Frederico Méier, 14. 😍 Venham conferir de pertinho! 🌴🌵💛💙  #Verao2017Citycol #modabarata #NaCitycolTem;Photo;NA;NA;2017-09-29T16:01:12Z;NA;0;0;0;0;0;0;0;0;0;0;0;0;0;0;0;0;0;0;0;0;0;0;0;0;0;0;NA;4;324;11
417092451820846_687662871430468;https://www.facebook.com/lojascitycol/photos/a.418868384976586/687662871430468/?type=3;A @bibibevilaqua já está preparada para o verão!🌴🌺 Adoramos o clique!! Maio: 34,99 - Short: 17,99 💛💙 #Verao2017Citycol #modabarata #NaCitycolTem;Photo;NA;NA;2017-09-29T07:02:15Z;NA;0;0;0;0;0;0;0;0;0;0;0;0;0;0;0;0;0;0;0;0;0;0;0;0;0;0;NA;4;91;5
417092451820846_687437941452961;https://www.facebook.com/lojascitycol/photos/a.418868384976586/687437941452961/?type=3;A gente promete que falta muito pouco! Fiquem ligadinhas que já já divulgaremos a data! 💙💛 #VemCityNovaporAí - Rua da Alfândega, 225.;Photo;NA;NA;2017-09-28T16:01:23Z;NA;0;0;0;0;0;0;0;0;0;0;0;0;0;0;0;0;0;0;0;0;0;0;0;0;0;0;NA;2;74;10
417092451820846_687303428133079;https://www.facebook.com/lojascitycol/photos/a.418868384976586/687303428133079/?type=3;#NaCitycolTem: lingeries lindas para você! 💛💙Confira em nossas lojas! #Verao2017Citycol #modabarata #NaCitycolTem;Photo;NA;NA;2017-09-28T07:01:41Z;NA;0;0;0;0;0;0;0;0;0;0;0;0;0;0;0;0;0;0;0;0;0;0;0;0;0;0;NA;4;294;6
417092451820846_687109961485759;https://www.facebook.com/lojascitycol/photos/a.418868384976586/687109961485759/?type=3;Para vocês darem uma espiadinha no que vem por aí! 👀#2018 #BackstagedaCity;Photo;NA;NA;2017-09-27T16:01:06Z;NA;0;0;0;0;0;0;0;0;0;0;0;0;0;0;0;0;0;0;0;0;0;0;0;0;0;0;NA;1;39;1
417092451820846_686968878166534;https://www.facebook.com/lojascitycol/photos/a.418868384976586/686968878166534/?type=3;Vem que a coleção Tropicana chegou na nossa loja de Nilópolis!🌵🌺🌴💙💛 #Verao2017Citycol #modabarata #NaCitycolTem;Photo;NA;NA;2017-09-27T07:05:04Z;NA;0;0;0;0;0;0;0;0;0;0;0;0;0;0;0;0;0;0;0;0;0;0;0;0;0;0;NA;7;761;37
417092451820846_686778758185546;https://www.facebook.com/lojascitycol/photos/a.418868384976586/686778758185546/?type=3;Nossas #CityBloggers Lu (@@aieuqueroo) e Mari (@marianamorenoo) arrasando com o #Verão2017 da City! 😍🌴🌺Confira em nossas lojas!! #Verao2017Citycol #modabarata #NaCitycolTem;Photo;NA;NA;2017-09-26T16:01:38Z;NA;0;0;0;0;0;0;0;0;0;0;0;0;0;0;0;0;0;0;0;0;0;0;0;0;0;0;NA;4;168;2
417092451820846_686626891534066;https://www.facebook.com/lojascitycol/photos/a.418868384976586/686626891534066/?type=3;Os 50 tons de azul invadiram a loja de Morro Agudo. Confira de pertinho e se apaixone!💙😍💙 #Verao2017Citycol #modabarata #NaCitycolTem;Photo;NA;NA;2017-09-26T07:01:23Z;NA;0;0;0;0;0;0;0;0;0;0;0;0;0;0;0;0;0;0;0;0;0;0;0;0;0;0;NA;8;717;26
417092451820846_686434098220012;https://www.facebook.com/lojascitycol/photos/a.418868384976586/686434098220012/?type=3;#regram da musa @marianamorenoo com look completo City!💙😍 #Verao2017Citycol #modabarata #NaCitycolTem #CityBloggers;Photo;NA;NA;2017-09-25T16:01:42Z;NA;0;0;0;0;0;0;0;0;0;0;0;0;0;0;0;0;0;0;0;0;0;0;0;0;0;0;NA;3;158;3
417092451820846_686278461568909;https://www.facebook.com/lojascitycol/photos/a.418868384976586/686278461568909/?type=3;Falta pouuuco! Essa semana divulgaremos a data oficial! Fiquem ligadinhas!💛💙 #VemCityNovaporAí;Photo;NA;NA;2017-09-25T07:02:05Z;NA;0;0;0;0;0;0;0;0;0;0;0;0;0;0;0;0;0;0;0;0;0;0;0;0;0;0;NA;NA;76;7
417092451820846_686008271595928;https://www.facebook.com/lojascitycol/photos/a.418868384976586/686008271595928/?type=3;Mais uma tee do #Verão2017 da City que está fazendo o maior sucesso. A Amandinha (@achadosfashion_rj) já garantiu a dela! Venha garantir a sua também! 😉🌺🌴 #CityBloggers #Verao2017Citycol #modabarata #NaCitycolTem;Photo;NA;NA;2017-09-24T14:00:40Z;NA;0;0;0;0;0;0;0;0;0;0;0;0;0;0;0;0;0;0;0;0;0;0;0;0;0;0;NA;NA;116;6
417092451820846_685488168314605;https://www.facebook.com/lojascitycol/photos/a.418868384976586/685488168314605/?type=3;Essa é a coleção TROPICANA, inspirada em países e ilhas latinas, totalmente “calientes” – Porto Rico, Cuba e México. As estampas tem inspiração em elementos tropicais como palmeiras, frutas, flores, cactus, sombreros, tucanos e papagaios – que darão o ritmo a loucura de babados nas roupas. 🌴🌺🌵 #Verao2017Citycol #modabarata #NaCitycolTem;Photo;NA;NA;2017-09-23T07:02:25Z;NA;0;0;0;0;0;0;0;0;0;0;0;0;0;0;0;0;0;0;0;0;0;0;0;0;0;0;NA;5;437;14
417092451820846_685255858337836;https://www.facebook.com/lojascitycol/photos/a.418868384976586/685255858337836/?type=3;Blusa mais a cara da estação impossível!🌺🌴 @aieuqueroo #Verao2017Citycol #modabarata #NaCitycolTem;Photo;NA;NA;2017-09-22T16:03:12Z;NA;0;0;0;0;0;0;0;0;0;0;0;0;0;0;0;0;0;0;0;0;0;0;0;0;0;0;NA;1;102;1
417092451820846_685095385020550;https://www.facebook.com/lojascitycol/posts/685095385020550;Ontem rolou a inauguração da City do Prezunic de Campo Grande! Passa o dedo pro lado e confira as fotos. Venham nos visitar!!💙💛 #Verao2017Citycol #modabarata #NaCitycolTem;Photo;NA;NA;2017-09-22T07:04:42Z;NA;0;0;0;0;0;0;0;0;0;0;0;0;0;0;0;0;0;0;0;0;0;0;0;0;0;0;NA;3;419;18
417092451820846_684837365046352;https://www.facebook.com/lojascitycol/photos/a.418868384976586/684837365046352/?type=3;A votação foi um pouco acirrada, mas o bom e velho amarelinho da City foi o grande vencedor! Muito obrigada a todo mundo que votou! Vocês são demais!💛💙;Photo;NA;NA;2017-09-21T16:01:28Z;NA;0;0;0;0;0;0;0;0;0;0;0;0;0;0;0;0;0;0;0;0;0;0;0;0;0;0;NA;4;302;17
417092451820846_684691695060919;https://www.facebook.com/lojascitycol/photos/a.418868384976586/684691695060919/?type=3;Aquele pretinho básico que todas devem ter no armário. Ah, e é uma ótima opção para o RIR, hein! Amarra um casaco na cintura, coloca um tênis/bota e vai! 😉 @aieuqueroo #Verao2017Citycol #modabarata #NaCitycolTem;Photo;NA;NA;2017-09-21T07:01:56Z;NA;0;0;0;0;0;0;0;0;0;0;0;0;0;0;0;0;0;0;0;0;0;0;0;0;0;0;NA;5;181;9
417092451820846_684470921749663;https://www.facebook.com/lojascitycol/posts/684470921749663;Meninas e meninos: precisamos da opinião de vocês!😬 Queremos mudar a foto do perfil e como adoramos que nossos seguidores participem do mundo da City, vai rolar uma votação!😍 O avatar mais votado por vocês será o escolhido! Vamos la! Temos 24h pra escolher!😉;Photo;NA;NA;2017-09-20T16:15:20Z;NA;0;0;0;0;0;0;0;0;0;0;0;0;0;0;0;0;0;0;0;0;0;0;0;0;0;0;NA;3;398;503
417092451820846_684324728430949;https://www.facebook.com/lojascitycol/photos/a.418868384976586/684324728430949/?type=3;"Começando essa quarta com a alegria e beleza da Nat do @achados_rj com a nossa tee ""fresh""! Adoramos o look e o clique! 😍🌺🌿🌾 #Verao2017Citycol #modabarata #NaCitycolTem #CityBloggers";Photo;NA;NA;2017-09-20T07:01:55Z;NA;0;0;0;0;0;0;0;0;0;0;0;0;0;0;0;0;0;0;0;0;0;0;0;0;0;0;NA;3;90;2
417092451820846_684110891785666;https://www.facebook.com/lojascitycol/photos/a.418868384976586/684110891785666/?type=3;Tá pintando por aí uma City novinha, cheia de novidades e supresas para as nossas clientes! Chegou a vez da Citycol da rua da Alfândega, 225! Aguardem!😉 #VemCityNovaporAí;Photo;NA;NA;2017-09-19T16:01:13Z;NA;0;0;0;0;0;0;0;0;0;0;0;0;0;0;0;0;0;0;0;0;0;0;0;0;0;0;NA;4;159;11
417092451820846_683960585134030;https://www.facebook.com/lojascitycol/photos/a.418868384976586/683960585134030/?type=3;Mais um vestido de arrasar da nossa linha Plus! Vem pra City! @marianamorenoo🌺🌴 #Verao2017Citycol #modabarata #NaCitycolTem;Photo;NA;NA;2017-09-19T07:02:00Z;NA;0;0;0;0;0;0;0;0;0;0;0;0;0;0;0;0;0;0;0;0;0;0;0;0;0;0;NA;5;334;29
417092451820846_683735765156512;https://www.facebook.com/lojascitycol/photos/a.418868384976586/683735765156512/?type=3;A moda praia também chegou na City de Araruama! Vem conhecer de pertinho!🐚🌴😉 #Verao2017Citycol #modabarata #NaCitycolTem;Photo;NA;NA;2017-09-18T16:01:45Z;NA;0;0;0;0;0;0;0;0;0;0;0;0;0;0;0;0;0;0;0;0;0;0;0;0;0;0;NA;2;236;3
417092451820846_683539761842779;https://www.facebook.com/lojascitycol/photos/a.418868384976586/683539761842779/?type=3;Começando a semana com #regram da nossa Embaixadora Amanda (@achadosfashion_rj) com a nossa saia floral que tá sendo o maior sucesso! Arrasou, Amandinha!🌸😍 #Verao2017Citycol #modabarata #NaCitycolTem #CityBloggers;Photo;NA;NA;2017-09-18T07:01:52Z;NA;0;0;0;0;0;0;0;0;0;0;0;0;0;0;0;0;0;0;0;0;0;0;0;0;0;0;NA;5;181;3
417092451820846_683318368531585;https://www.facebook.com/lojascitycol/photos/a.418868384976586/683318368531585/?type=3;O Hawaii e Miami sempre são lembrados por sua beleza e o seu clima tropical. Nessa estação, esse “mood” garante looks frescos e modernos nas estampas de abacaxi, flamingos, coqueiros, sorvetes, que inspirarão as formas da estação: tops croppeds, um ombro só, vestidos e saias com babados, pantacourt, shorts de malha, sarja, viscose e jeans. Venham conferir de pertinho na nossa loja da Tijuca! #Verao2017Citycol #modabarata #NaCitycolTem;Photo;NA;NA;2017-09-17T14:01:33Z;NA;0;0;0;0;0;0;0;0;0;0;0;0;0;0;0;0;0;0;0;0;0;0;0;0;0;0;NA;8;452;12
417092451820846_682834518579970;https://www.facebook.com/lojascitycol/photos/a.418868384976586/682834518579970/?type=3;Estamos morrendo de amores pelo casal vestindo o #Verão2017 da City! @aieuqueroo #regram #CityBloggers #Verao2017Citycol #modabarata #NaCitycolTem;Photo;NA;NA;2017-09-16T07:02:09Z;NA;0;0;0;0;0;0;0;0;0;0;0;0;0;0;0;0;0;0;0;0;0;0;0;0;0;0;NA;2;110;1
417092451820846_682627375267351;https://www.facebook.com/lojascitycol/photos/a.418868384976586/682627375267351/?type=3;Porque eles também podem e devem andar no estilo!🌴  #Verao2017Citycol #modabarata #NaCitycolTem;Photo;NA;NA;2017-09-15T16:01:34Z;NA;0;0;0;0;0;0;0;0;0;0;0;0;0;0;0;0;0;0;0;0;0;0;0;0;0;0;NA;5;176;3
417092451820846_682492481947507;https://www.facebook.com/lojascitycol/photos/a.418868384976586/682492481947507/?type=3;Bom dia com a musa @marianamorenoo colorindo a nossa sexta com a blusa butterfly!😍 #Verao2017Citycol #modabarata #NaCitycolTem;Photo;NA;NA;2017-09-15T07:03:10Z;NA;0;0;0;0;0;0;0;0;0;0;0;0;0;0;0;0;0;0;0;0;0;0;0;0;0;0;NA;NA;45;NA
417092451820846_682259525304136;https://www.facebook.com/lojascitycol/photos/a.418868384976586/682259525304136/?type=3;Essa é a coleção Fundo do Mar que chegou na loja de Alcântara. Ela foi inspirada na vida aquática artificial, nos aquários com sereias, estrelas do mar, cavalos marinhos, conchas e tubarões. As tonalidades presentes neste habitat são as que inspiram roupas da estação. Confira!🐚💙 #Verao2017Citycol #modabarata #NaCitycolTem;Photo;NA;NA;2017-09-14T16:01:24Z;NA;0;0;0;0;0;0;0;0;0;0;0;0;0;0;0;0;0;0;0;0;0;0;0;0;0;0;NA;5;463;33
417092451820846_682087025321386;https://www.facebook.com/lojascitycol/photos/a.418868384976586/682087025321386/?type=3;Corre que ainda dá tempo de garantir o seu cropped com patches para o Rock in Rio!🤘 @aieuqueroo #Verao2017Citycol #modabarata #NaCitycolTem;Photo;NA;NA;2017-09-14T07:02:20Z;NA;0;0;0;0;0;0;0;0;0;0;0;0;0;0;0;0;0;0;0;0;0;0;0;0;0;0;NA;1;94;NA
417092451820846_681841925345896;https://www.facebook.com/lojascitycol/photos/a.418868384976586/681841925345896/?type=3;Nossa loja de Nova Iguaçu está prontinha esperando por vocês! Venham conferir as novidades! 🌴🌺 #Verao2017Citycol #modabarata #NaCitycolTem;Photo;NA;NA;2017-09-13T16:01:33Z;NA;0;0;0;0;0;0;0;0;0;0;0;0;0;0;0;0;0;0;0;0;0;0;0;0;0;0;NA;2;347;5
417092451820846_681660992030656;https://www.facebook.com/lojascitycol/photos/a.418868384976586/681660992030656/?type=3;Daqueles vestidos que colorem o dia! @marianamorenoo 💛🌴🌺 #Verao2017Citycol #modabarata #NaCitycolTem;Photo;NA;NA;2017-09-13T07:02:22Z;NA;0;0;0;0;0;0;0;0;0;0;0;0;0;0;0;0;0;0;0;0;0;0;0;0;0;0;NA;6;351;12
417092451820846_681434445386644;https://www.facebook.com/lojascitycol/photos/a.418868384976586/681434445386644/?type=3;Vem que a moda praia chegou na City!🌺🌴🐚 #Verao2017Citycol #modabarata #NaCitycolTem;Photo;NA;NA;2017-09-12T16:01:22Z;NA;0;0;0;0;0;0;0;0;0;0;0;0;0;0;0;0;0;0;0;0;0;0;0;0;0;0;NA;8;727;29
417092451820846_681260235404065;https://www.facebook.com/lojascitycol/photos/a.418868384976586/681260235404065/?type=3;Aquele body básico, perfeito para todas as ocasiões. :) Confira em nossas lojas. #Verao2017Citycol #modabarata #NaCitycolTem;Photo;NA;NA;2017-09-12T07:01:33Z;NA;0;0;0;0;0;0;0;0;0;0;0;0;0;0;0;0;0;0;0;0;0;0;0;0;0;0;NA;1;141;3
417092451820846_681054212091334;https://www.facebook.com/lojascitycol/photos/a.418868384976586/681054212091334/?type=3;Chegou em Nilópolis a coleção Jardim Natural que recebe tons de verde, às estampas vindas diretamente de pétalas de flores, texturas encontradas em folhas e pequenos insetos, o “mood” natural encontra-se em alta! 🌺🌴#Verao2017Citycol #modabarata #NaCitycolTem;Photo;NA;NA;2017-09-11T16:01:16Z;NA;0;0;0;0;0;0;0;0;0;0;0;0;0;0;0;0;0;0;0;0;0;0;0;0;0;0;NA;4;367;9
417092451820846_680923068771115;https://www.facebook.com/lojascitycol/photos/a.418868384976586/680923068771115/?type=3;Nossa musiane @marianamorenoo com a t-shirt desejo da Nova Coleção. R$17,99 #Verao2017Citycol #modabarata #NaCitycolTem;Photo;NA;NA;2017-09-11T07:01:51Z;NA;0;0;0;0;0;0;0;0;0;0;0;0;0;0;0;0;0;0;0;0;0;0;0;0;0;0;NA;1;97;NA
417092451820846_680701072126648;https://www.facebook.com/lojascitycol/photos/a.418868384976586/680701072126648/?type=3;Mais um pouquinho de uma das estampas mais fofas do nosso Verão 2017🌸. #Verao2017Citycol #modabarata #NaCitycolTem;Photo;NA;NA;2017-09-10T14:01:21Z;NA;0;0;0;0;0;0;0;0;0;0;0;0;0;0;0;0;0;0;0;0;0;0;0;0;0;0;NA;6;421;10
417092451820846_680227262174029;https://www.facebook.com/lojascitycol/photos/a.418868384976586/680227262174029/?type=3;Para morrer de amores pela Lu (@aieuqueroo) e pelo nosso conjuntinho flower!🌸 Confira em nossas lojas! #Verao2017Citycol #modabarata #NaCitycolTem #CityBloggers;Photo;NA;NA;2017-09-09T07:02:17Z;NA;0;0;0;0;0;0;0;0;0;0;0;0;0;0;0;0;0;0;0;0;0;0;0;0;0;0;NA;1;157;1
417092451820846_680009568862465;https://www.facebook.com/lojascitycol/photos/a.418868384976586/680009568862465/?type=3;Já chegou em Niterói a coleção Jardim Natural que recebe tons de verde, às estampas vindas diretamente de pétalas de flores, texturas encontradas em folhas e pequenos insetos, o “mood” natural encontra-se em alta! Apostem, vocês vão se apaixonar!🌴🌺 #Verao2017Citycol #modabarata #NaCitycolTem;Photo;NA;NA;2017-09-08T16:01:25Z;NA;0;0;0;0;0;0;0;0;0;0;0;0;0;0;0;0;0;0;0;0;0;0;0;0;0;0;NA;9;438;15
417092451820846_679853095544779;https://www.facebook.com/lojascitycol/photos/a.418868384976586/679853095544779/?type=3;A nossa blusa chocker ganhou um toque especial de verão!🌺 🌴 R$19,99 Confira na City mais próxima! @aieuqueroo #Verao2017Citycol #modabarata #NaCitycolTem #CityBloggers;Photo;NA;NA;2017-09-08T07:02:02Z;NA;0;0;0;0;0;0;0;0;0;0;0;0;0;0;0;0;0;0;0;0;0;0;0;0;0;0;NA;3;146;NA
417092451820846_679462248917197;https://www.facebook.com/lojascitycol/photos/a.418868384976586/679462248917197/?type=3;E a coleção nova está invadindo a loja da Tijuca!🌺🌴 Hoje estamos fechados, mas amanhã funcionaremos normalmente. 😉 #Verao2017Citycol #modabarata #NaCitycolTem;Photo;NA;NA;2017-09-07T07:02:02Z;NA;0;0;0;0;0;0;0;0;0;0;0;0;0;0;0;0;0;0;0;0;0;0;0;0;0;0;NA;3;349;9
417092451820846_679240692272686;https://www.facebook.com/lojascitycol/photos/a.418868384976586/679240692272686/?type=3;Charme, cor e muito amor por ela e por o nosso vestido floral!😍🌴🌸 @marianamorenoo  musa como sempre!💙 #Verao2017Citycol #modabarata #NaCitycolTem #CityBloggers;Photo;NA;NA;2017-09-06T16:01:32Z;NA;0;0;0;0;0;0;0;0;0;0;0;0;0;0;0;0;0;0;0;0;0;0;0;0;0;0;NA;3;144;3
417092451820846_679087295621359;https://www.facebook.com/lojascitycol/photos/a.418868384976586/679087295621359/?type=3;Nossa loja de Cachoeiro de Itapemirim já recebeu as novidades do Verão 17.🌴🌺 Venham conferir!  #Verao2017Citycol #modabarata #NaCitycolTem;Photo;NA;NA;2017-09-06T07:02:01Z;NA;0;0;0;0;0;0;0;0;0;0;0;0;0;0;0;0;0;0;0;0;0;0;0;0;0;0;NA;3;305;9
417092451820846_678876025642486;https://www.facebook.com/lojascitycol/photos/a.418868384976586/678876025642486/?type=3;E essa semana a Coleção de Verão 17 está chegando em todas as lojas. 🌴😍 A Lu, do @aieuqueroo ficou MUSA com o nosso longo, não é?🌺;Photo;NA;NA;2017-09-05T16:01:54Z;NA;0;0;0;0;0;0;0;0;0;0;0;0;0;0;0;0;0;0;0;0;0;0;0;0;0;0;NA;4;307;12
417092451820846_678701935659895;https://www.facebook.com/lojascitycol/photos/a.418868384976586/678701935659895/?type=3;Cabo Frio está com novidades apaixonantes. Vem conferir de pertinho!🌸😍 #NaCitycolTem #modabarata #lookdodia;Photo;NA;NA;2017-09-05T07:01:47Z;NA;0;0;0;0;0;0;0;0;0;0;0;0;0;0;0;0;0;0;0;0;0;0;0;0;0;0;NA;3;213;3
417092451820846_678465589016863;https://www.facebook.com/lojascitycol/photos/a.418868384976586/678465589016863/?type=3;Para colorir o dia das pequenas. R$12,99 #NaCitycolTem #modabarata #lookdodia;Photo;NA;NA;2017-09-04T16:01:26Z;NA;0;0;0;0;0;0;0;0;0;0;0;0;0;0;0;0;0;0;0;0;0;0;0;0;0;0;NA;NA;201;9
417092451820846_678307379032684;https://www.facebook.com/lojascitycol/photos/a.418868384976586/678307379032684/?type=3;Detalhes do nosso abacaxi de paetês!😍🍍💛;Photo;NA;NA;2017-09-04T07:01:37Z;NA;0;0;0;0;0;0;0;0;0;0;0;0;0;0;0;0;0;0;0;0;0;0;0;0;0;0;NA;1;190;14
417092451820846_678062165723872;https://www.facebook.com/lojascitycol/photos/a.418868384976586/678062165723872/?type=3;O espírito tropical tá invadindo a City!🍍🌺😍 #NaCitycolTem #modabarata #lookdodia;Photo;NA;NA;2017-09-03T14:25:19Z;NA;0;0;0;0;0;0;0;0;0;0;0;0;0;0;0;0;0;0;0;0;0;0;0;0;0;0;NA;6;630;18
417092451820846_677556309107791;https://www.facebook.com/lojascitycol/photos/a.418868384976586/677556309107791/?type=3;Para as pequenas que amam pink! 12,99 🌸 #NaCitycolTem #modabarata #lookdodia;Photo;NA;NA;2017-09-02T07:01:53Z;NA;0;0;0;0;0;0;0;0;0;0;0;0;0;0;0;0;0;0;0;0;0;0;0;0;0;0;NA;NA;125;2
417092451820846_677302885799800;https://www.facebook.com/lojascitycol/photos/a.418868384976586/677302885799800/?type=3;Nossa loja de Vila Isabel tá recheada de novidades pra vocês! Aproveitem o sabadão pra conferir de pertinho!😉 #NaCitycolTem #modabarata #lookdodia;Photo;NA;NA;2017-09-01T16:01:25Z;NA;0;0;0;0;0;0;0;0;0;0;0;0;0;0;0;0;0;0;0;0;0;0;0;0;0;0;NA;5;324;7
417092451820846_677115709151851;https://www.facebook.com/lojascitycol/photos/a.418868384976586/677115709151851/?type=3;Um arco-íris de cores para as pequenas! R$12,99. #NaCitycolTem #modabarata #lookdodia;Photo;NA;NA;2017-09-01T07:01:29Z;NA;0;0;0;0;0;0;0;0;0;0;0;0;0;0;0;0;0;0;0;0;0;0;0;0;0;0;NA;4;276;11
417092451820846_676885352508220;https://www.facebook.com/lojascitycol/photos/a.418868384976586/676885352508220/?type=3;Aquele zoom para vocês verem bem de pertinho!🌸 #NaCitycolTem #modabarata #lookdodia;Photo;NA;NA;2017-08-31T16:01:15Z;NA;0;0;0;0;0;0;0;0;0;0;0;0;0;0;0;0;0;0;0;0;0;0;0;0;0;0;NA;NA;150;7
417092451820846_676725862524169;https://www.facebook.com/lojascitycol/photos/a.418868384976586/676725862524169/?type=3;Mais uma variante do nosso vestido apaixonante! 🌸 R$49,99 #NaCitycolTem #modabarata #lookdodia;Photo;NA;NA;2017-08-31T07:01:41Z;NA;0;0;0;0;0;0;0;0;0;0;0;0;0;0;0;0;0;0;0;0;0;0;0;0;0;0;NA;4;301;8
417092451820846_676506722546083;https://www.facebook.com/lojascitycol/photos/a.418868384976586/676506722546083/?type=3;E quem não essa estampa de abacaxi, hein? 🍍 R$29,99 #NaCitycolTem #modabarata #lookdodia;Photo;NA;NA;2017-08-30T16:01:03Z;NA;0;0;0;0;0;0;0;0;0;0;0;0;0;0;0;0;0;0;0;0;0;0;0;0;0;0;NA;3;200;15
417092451820846_676341112562644;https://www.facebook.com/lojascitycol/photos/a.418868384976586/676341112562644/?type=3;#regram cheio de amor por esse look que a lindona da Kate postou com o nosso vestido muso!😍 Amamooos! #CityBloggers #NaCitycolTem #modabarata;Photo;NA;NA;2017-08-30T07:01:51Z;NA;0;0;0;0;0;0;0;0;0;0;0;0;0;0;0;0;0;0;0;0;0;0;0;0;0;0;NA;2;153;1
417092451820846_676101305919958;https://www.facebook.com/lojascitycol/photos/a.418868384976586/676101305919958/?type=3;Não dá para resistir! Leve uma de cada cor para a sua princesa! 😍R$12,99 #kids #modabarata #lookdodia #NaCitycolTem;Photo;NA;NA;2017-08-29T16:01:13Z;NA;0;0;0;0;0;0;0;0;0;0;0;0;0;0;0;0;0;0;0;0;0;0;0;0;0;0;NA;4;372;20
417092451820846_675682275961861;https://www.facebook.com/lojascitycol/photos/a.418868384976586/675682275961861/?type=3;#regram da nossa linda Roberta do @carioca_plus_size com look todinho Citycol! 🌴😍 #CityBloggers #NaCitycolTem #modabarata;Photo;NA;NA;2017-08-28T16:02:10Z;NA;0;0;0;0;0;0;0;0;0;0;0;0;0;0;0;0;0;0;0;0;0;0;0;0;0;0;NA;NA;155;4
417092451820846_675535869309835;https://www.facebook.com/lojascitycol/photos/a.418868384976586/675535869309835/?type=3;Para morrer de amores com o look da nossa embaixadora Amanda do @achadosfashion_rj com o vestido florido de apenas 49,99.😍#regram #CityBloggers #NaCitycolTem #modabarata;Photo;NA;NA;2017-08-28T07:02:34Z;NA;0;0;0;0;0;0;0;0;0;0;0;0;0;0;0;0;0;0;0;0;0;0;0;0;0;0;NA;NA;102;1
417092451820846_675278022668953;https://www.facebook.com/lojascitycol/photos/a.418868384976586/675278022668953/?type=3;Fofura de domingo com a nossa #CityBlogger @elis_shiis usando nosso conjunto de poá. 😍#regram #CityBloggers #NaCitycolTem #kids #modabarata;Photo;NA;NA;2017-08-27T14:01:13Z;NA;0;0;0;0;0;0;0;0;0;0;0;0;0;0;0;0;0;0;0;0;0;0;0;0;0;0;NA;1;275;5
417092451820846_674572889406133;https://www.facebook.com/lojascitycol/photos/a.418868384976586/674572889406133/?type=3;Detalhes da nossa estampa tropical que está fazendo o maior sucesso!🌸  #NaCitycolTem #modabarata #lookdodia;Photo;NA;NA;2017-08-25T16:01:31Z;NA;0;0;0;0;0;0;0;0;0;0;0;0;0;0;0;0;0;0;0;0;0;0;0;0;0;0;NA;2;107;1
417092451820846_674430749420347;https://www.facebook.com/lojascitycol/photos/a.418868384976586/674430749420347/?type=3;Mais uma variante da nossa blusa tropical! É para morrer de amores! R$29,99🌺🌴 #NaCitycolTem #modabarata #lookdodia;Photo;NA;NA;2017-08-25T07:05:28Z;NA;0;0;0;0;0;0;0;0;0;0;0;0;0;0;0;0;0;0;0;0;0;0;0;0;0;0;NA;4;344;12
